Company Name,Symbol,Headline,Publish Date,Sentiment
Larsen & Toubro Ltd.,LT,"𑆩𑆳𑆬𑆴𑆤𑆵 Sarah L Gates on Twitter: ""Armed Khalistani mobs attack Australian Indian Hindus today at Federation Square. Public display of violence and intimidation around families with little kids. https://t.co/SzTvEmmTqj"" / Twitter",2023-01-29,Neutral
Larsen & Toubro Ltd.,LT,Hindu Concept of Self Defense: धर्म हिंसा तथैव च: l #Hindutva [Thread] From 'Six Glorious Epochs of Indian History' by Veer Savarkar.,2023-06-01,Positive
Larsen & Toubro Ltd.,LT,"Panchkula’s Aashna Bagri, Dance Sports Athlete, Wins Int’l Dance Championship",2023-06-22,Neutral
Larsen & Toubro Ltd.,LT,"L&T, BHEL and so many companies a part of Chandrayaan-3; check the list here",2023-08-24,Positive
Larsen & Toubro Ltd.,LT,The kinn*rs of JNU left students (mera l*da students) doing usual things of apna relative ch*dana...🤌,2023-04-19,Neutral
Mahindra & Mahindra Ltd.,M&M,"A Bhopal-based startup, Swaayatt Robots, conducted the demonstration of autonomous driving technology using a Mahindra Bolero, modifying it into a driverless SUV.",2024-05-02,Positive
Mahindra & Mahindra Ltd.,M&M,"RBI cracks down on Kotak Mahindra Bank; bars onboarding new customers through online, mobile banking and issuing new credit cards",2024-04-25,Neutral
Mahindra & Mahindra Ltd.,M&M,"2,000 Ghost Customers, Fake Mahindra Account: Rs 150 Crore Scam In Mizoram Auto-finance scam",2024-05-02,Positive
Mahindra & Mahindra Ltd.,M&M,Anand Mahindra Praises Chanakyapuri's Lush Public Gardens | Ganga News English,2024-03-24,Neutral
Mahindra & Mahindra Ltd.,M&M,"Mahindra's Classic Legends to pump in ₹1,000 crore till FY26 to rev up business",2023-09-14,Positive
Mahindra & Mahindra Ltd.,M&M,"APG, IFC & AIIB in race to put $250 million into Mahindra InvIT",2023-08-22,Neutral
Mahindra & Mahindra Ltd.,M&M,"Why This Engineering Dropout Is A Favorite Of Anand Mahindra, Who Had To Close His Eatery Due To 18 Lakhs Debt | India News | Zee News",2023-06-12,Neutral
Mahindra & Mahindra Ltd.,M&M,Anand Mahindra supports Joe Biden's bid for second term as US President: 'I like his audacity',2023-04-27,Neutral
Mahindra & Mahindra Ltd.,M&M,"Mahindra has a strong growth trajectory: Anish Shah, MD",2023-06-12,Neutral
Mahindra & Mahindra Ltd.,M&M,XUV700 catches fire on Jaipur highway; Mahindra alleges tampering of original wiring,2023-05-24,Neutral
Mahindra & Mahindra Ltd.,M&M,Global pension funds in fray for Mahindra Susten InvIT stake,2023-04-26,Neutral
Mahindra & Mahindra Ltd.,M&M,Uday Kotak to transition to non-executive role after CEO tenure at Kotak Mahindra Bank,2023-04-23,Neutral
Mahindra & Mahindra Ltd.,M&M,"Remembering Keshub Mahindra - Tycoon who turned down Padma Bhushan on grounds of probity - He passed away on April 12, 2023",2023-04-16,Neutral
Mahindra & Mahindra Ltd.,M&M,"Layoffs hit TCS, Infosys, Tech Mahindra: Is your job at risk? I Watch",2023-02-11,Neutral
Mahindra & Mahindra Ltd.,M&M,"Car Retail Sales Feb 2023 - Maruti, Tata, Mahindra, Kia, BYD, Skoda, VW",2023-03-08,Negative
Mahindra & Mahindra Ltd.,M&M,'Saddened by violence.' Anand Mahindra reiterates that 'discipline & skills' will make Agniveers eminently employable,2022-06-20,Negative
Mahindra & Mahindra Ltd.,M&M,"[Aditya Raj kaul] Yasin Malik was invited as a “Youth Icon” at India Today Conclave (2008). When I questioned Anand Mahindra, who presided the panel, for calling him “secular”“peaceful” he blocked me on twitter.Watch what Yasin Malik did in Kashmir Files",2022-03-13,Neutral
Mahindra & Mahindra Ltd.,M&M,Mahindra Group News: Mahindra Group likely to split auto business into 3 units,2022-05-06,Neutral
Mahindra & Mahindra Ltd.,M&M,Anand Mahindra plans to start medical college in India after seeing huge numbers of Indian students studying medicine abroad,2022-03-04,Positive
Mahindra & Mahindra Ltd.,M&M,"Kotak Mahindra | Axis Bank | HDFC Bank : After Axis and HDFC Bank, will Kotak Mahindra go the M&A way?",2022-04-06,Positive
Mahindra & Mahindra Ltd.,M&M,"kotak mahindra bank: Citi consumer business: Kotak Mahindra, Axis and IndusInd submit bids",2021-10-27,Neutral
Mahindra & Mahindra Ltd.,M&M,"After Mahindra, now Thomas Blom Hansen, Reliance Dhirubhai-Ambani Professor of Anthropology, & Founder-Director of Stanford's Centre For South Asia, (which itself is a cosponsor of Dismantling Global Hindutva), as Moderator at the CIA linked conference",2021-09-12,Neutral
Mahindra & Mahindra Ltd.,M&M,‘कूल’ बने रहने के लिए गाय के गोबर के कोट वाली भारतीय कारों से मिलें: Mahindra XUV500 से Hyundai i20,2021-09-24,Neutral
Mahindra & Mahindra Ltd.,M&M,Mahindra XUV700 Gets Driver Drowsiness Detection Safety Feature,2021-07-18,Neutral
Mahindra & Mahindra Ltd.,M&M,"TCS, Infosys, Wipro, HCL, Tech Mahindra, Cognizant to cut 3 million jobs by 2022: Report",2021-06-16,Negative
Maruti Suzuki India Ltd.,MARUTI,"A Maruti car finally has 5 star safety rating. It is not Swift, Baleno, Brezza, GV. The new Dzire is the maiden model from Maruti Suzuki to have garnered a five-star Global NCAP safety rating.",2024-11-09,Neutral
Maruti Suzuki India Ltd.,MARUTI,"Maruti Suzuki Q1 preview: Profit may rise 2x YoY on strong sales, margin show",2023-07-31,Neutral
Maruti Suzuki India Ltd.,MARUTI,Maruti Suzuki: April 2023 Sales Jumped 13%,2023-05-04,Positive
Maruti Suzuki India Ltd.,MARUTI,Maruti Suzuki Grand Vitara launch tomorrow: Top 5 things to know - Times of India,2022-09-25,Neutral
Maruti Suzuki India Ltd.,MARUTI,Features of new 2022 Maruti Suzuki Alto K10 that make it better than previous model,2022-08-26,Positive
Maruti Suzuki India Ltd.,MARUTI,"Maruti Suzuki says chip shortage hit Q2 profits, while company chairman reveals when to expect its electric vehicle",2021-10-29,Positive
Maruti Suzuki India Ltd.,MARUTI,maruti suzuki: Maruti may drive in SUVs priced up to ₹20 lakh in next three years,2021-12-02,Negative
Maruti Suzuki India Ltd.,MARUTI,"Maruti Suzuki Says Goodbye To Its Diesel Plan, Focus Is On Vehicles Powered By Alternative Fuels",2021-10-01,Positive
Maruti Suzuki India Ltd.,MARUTI,"Maruti Suzuki’s production hit for 2nd straight month amid chip shortage, shares slide",2021-10-04,Neutral
Maruti Suzuki India Ltd.,MARUTI,Maruti Suzuki Will Raise Prices In September Due To Increase In Input Costs,2021-08-30,Neutral
Maruti Suzuki India Ltd.,MARUTI,Maruti Suzuki India sells 2 lakh cars via digital channel since April 2019,2020-11-16,Neutral
Maruti Suzuki India Ltd.,MARUTI,Kia Motors (owned by Hyundai) is also asking for the 'freedom' of Kashmir,2022-02-06,Neutral
Maruti Suzuki India Ltd.,MARUTI,"The country's largest auto-maker had launched its vehicle leasing program - Maruti Suzuki vehicle subscription plans explained, now available in Delhi NCR, Bengaluru, Pune and Hyderabad",2020-09-26,Neutral
Maruti Suzuki India Ltd.,MARUTI,Maruti Suzuki India transports over 6.7 lakh cars through Indian Railways in 6 years,2020-07-10,Negative
Maruti Suzuki India Ltd.,MARUTI,Maruti Suzuki: The king of roads: Why Maruti sells one in every two cars in India,2017-07-12,Neutral
Maruti Suzuki India Ltd.,MARUTI,"Maruti Suzuki to recall over 60,000 units of Ciaz, Ertiga and XL6 models",2019-12-06,Neutral
Maruti Suzuki India Ltd.,MARUTI,"Maruti Suzuki reports 1.9% dip in sales at 1,50,630 units in November",2019-12-01,Neutral
Maruti Suzuki India Ltd.,MARUTI,Maruti job cuts: Maruti Suzuki cuts temporary workforce by 6% as sales sink,2019-08-03,Neutral
Maruti Suzuki India Ltd.,MARUTI,Maruti Suzuki To Bring The Jimny Mini SUV To India; Likely Rebadged as Gypsy,2019-08-21,Neutral
Maruti Suzuki India Ltd.,MARUTI,"Hit by slowdown, Maruti Suzuki to operate only one shift at all plants",2019-08-08,Negative
Maruti Suzuki India Ltd.,MARUTI,It’s the end of the road for the iconic Maruti Suzuki Gypsy – showrooms asked to stop bookings,2019-08-08,Negative
Maruti Suzuki India Ltd.,MARUTI,"The end of an era: Maruti drives off Gurugram. In the second half of 2018, Maruti Suzuki India Ltd began thinking of life beyond Gurugram. It had become far too cumbersome to continue manufacturing cars in the middle of a city which had turned into a bustling megapolis",2018-12-25,Neutral
Maruti Suzuki India Ltd.,MARUTI,Delhi Gets First Automated Driving Test Centre; To Be Maintained By Maruti Suzuki India,2019-03-06,Neutral
Maruti Suzuki India Ltd.,MARUTI,"Corruption, crony capitalism disappeared in one year of Modi government: RC Bhargava, Maruti Suzuki",2016-01-05,Negative
Maruti Suzuki India Ltd.,MARUTI,"Robots sweep across Maruti Suzuki’s shop floor. Maruti Suzuki has one robot for every 4 factory workers at its Manesar and Gurgaon car plants, signalling growing automation in India’s manufacturing sector",2017-05-19,Positive
NTPC Ltd.,NTPC,NTPC Subsidiary Signs MoU with Indian Army for Green Projects: Know More - Investing.com India,2023-03-21,Neutral
NTPC Ltd.,NTPC,"No scope of repair in Joshimath, NTPC engineers punctured aquifer: Expert",2023-01-13,Positive
NTPC Ltd.,NTPC,"NTPC could be front-runner to acquire SKS Power Generation, shares are really buoyant",2023-02-21,Neutral
NTPC Ltd.,NTPC,"NTPC to invest Rs 50,000 crore to add 10GW solar energy capacity by 2022",2019-12-26,Neutral
NTPC Ltd.,NTPC,Piyush Goyal on Twitter - People had laughed when I said solar energy prices will be below Rs.5/unit. Last Solar bid received by NTPC - Rs 4.63 per unit,2015-11-16,Neutral
NTPC Ltd.,NTPC,NTPC puts off solar projects auction amid developers concerns on evacuation,2018-05-19,Neutral
NTPC Ltd.,NTPC,NTPC cuts electricity cost by 13.6%,2017-09-04,Neutral
NTPC Ltd.,NTPC,"NTPC under Modi Sarkar installs India’s largest Floating Solar PV Plant at RGCCPP Kayamkulam, Kerala",2017-03-15,Neutral
NTPC Ltd.,NTPC,NTPC boiler blast in UP: Toll rises to 26; DM says likely to find more victims,2017-11-02,Negative
NTPC Ltd.,NTPC,When will media learn ethics of journalism ? Person guilty of attack on Aruna Shanbaug is hounded by media and now NTPC has fired him from his job.,2015-06-02,Negative
NTPC Ltd.,NTPC,NTPC to cut power supply to BSES discoms in Delhi from Sunday,2016-09-01,Positive
NTPC Ltd.,NTPC,"Assured of supplies from Coal India, NTPC refuses any imports this year [NTPC has been relying on imported coal for the past 10 years to meet its needs]",2016-04-08,Neutral
NTPC Ltd.,NTPC,NTPC bid to sell power on energy exchange could spell trouble for Delhi residents,2014-02-06,Neutral
NTPC Ltd.,NTPC,"Going for 100% metering will bring down power losses from 25% to 15%: Kulamani Biswal, NTPC",2016-03-16,Neutral
NTPC Ltd.,NTPC,Modi unveils first of its kind dollar-linked solar power contracts: The contracts will pay rupee equivalent of dollar tariff determined by the bidding and NTPC will create a fund to manage the currency risk it takes on,2015-07-11,Neutral
NTPC Ltd.,NTPC,A dark summer for Delhi? Capital could suffer power shortage as NTPC warns Kejriwal government it has other clients,2015-04-09,Positive
NTPC Ltd.,NTPC,NTPC plant being set up in Andhra Pradesh to kick off govt’s solar dream,2015-04-25,Neutral
NTPC Ltd.,NTPC,NTPC have 2 days of coal stock left; Govt steps in,2014-07-18,Positive
NTPC Ltd.,NTPC,Government decision on block de-allocation cost NTPC 2 years of progress,2014-07-02,Neutral
NTPC Ltd.,NTPC,NTPC looks for buying out stranded private power projects,2014-02-13,Positive
NTPC Ltd.,NTPC,NTPC alleges illegal mining in Jharkhand,2014-01-20,Positive
NTPC Ltd.,NTPC,"NTPC shares rebound, rise over 2% on value-buying",2013-12-11,Negative
NTPC Ltd.,NTPC,Power Sector - Just one example in which the NDA has massively outperformed the extremely inefficient UPA.,2017-09-27,Neutral
NTPC Ltd.,NTPC,Indian Financial Sector,2019-11-08,Neutral
NTPC Ltd.,NTPC,Indian Financial Sector,2019-08-26,Negative
Nestle India Ltd.,NESTLEIND,Shrinking middle class hitting FMCG firms: Nestle India,2024-10-25,Neutral
Nestle India Ltd.,NESTLEIND,"Prosecute Nestle for Cerelac 'scam', NGOs tell Swiss government | India News - Times of India",2024-06-17,Neutral
Nestle India Ltd.,NESTLEIND,"Nestle Faces Backlash Over Added Sugar In Baby Food Products, Stocks Take A Huge Hit",2024-04-19,Positive
Nestle India Ltd.,NESTLEIND,Nestle India says ‘cut sugars in baby food in last 5 years’ after damning report,2024-04-18,Neutral
Nestle India Ltd.,NESTLEIND,Nestle Adds 3 gm Sugar In Every Serving Of Cerelac Sold In India: Report,2024-04-18,Neutral
Nestle India Ltd.,NESTLEIND,Nestle Adds 3 gm Sugar In Every Serving Of Cerelac Sold In India: Report,2024-04-18,Neutral
Nestle India Ltd.,NESTLEIND,Entrance of a Gurdwara in Australia. Nestled between 2 Khalistan flags are pictures of Deep Sidhu with the words “End Hindu Fascism.” Deep Sidhu died in a car accident. He was an accused in the violent 2021 Indian Republic Day attack on Delhi’s Red Fort,2022-02-21,Negative
Nestle India Ltd.,NESTLEIND,"Charter of the Halal org funded by all Halal certified products-from Nestle Horlicks & Boost to Britannia biscuits to Patanjali & Amul states they will use funds to defend Muslim terror-accused.And true to charter,they fund for legal defense of LeT terrorists,Mujahideen blastcase,ISI cases-long list",2022-04-02,Neutral
Nestle India Ltd.,NESTLEIND,Nestle faces backlash for putting Lord Jagannath's pic on KitKat wrapper,2022-01-21,Neutral
Nestle India Ltd.,NESTLEIND,Nestle India tenders apology over wrong depiction of Manipur's Keibul Lamjao Park,2021-04-29,Positive
Nestle India Ltd.,NESTLEIND,"How safe are Maggi, KitKat, Nescafe? Nestle document reveals shocking details",2021-06-04,Neutral
Nestle India Ltd.,NESTLEIND,"Nestled in the North East, Moirang Reminds us of an Extraordinary Event in Indian",2021-01-23,Neutral
Nestle India Ltd.,NESTLEIND,Nestle India chief flags concern for industry over lower-than-expected monsoons,2019-05-18,Neutral
Nestle India Ltd.,NESTLEIND,"EXCLUSIVE: Nestle, GSK Consumer cut prices by 5-12% to pass on GST benefits",2017-11-28,Positive
Nestle India Ltd.,NESTLEIND,"Maggi makers Nestle, distributors fined ₹62 lakh in U.P. It “appears to be a case of application of incorrect standards,” says Nestle India spokesperson.",2017-11-28,Positive
Nestle India Ltd.,NESTLEIND,Nestle resumes Maggi noodles production at all plants in India,2015-11-30,Neutral
Nestle India Ltd.,NESTLEIND,"Bombay HC rules in favour of Nestle, but orders fresh Maggi tests",2015-08-13,Negative
Nestle India Ltd.,NESTLEIND,Govt to drag Nestle to consumer forum over Maggi,2015-08-11,Positive
Nestle India Ltd.,NESTLEIND,"#MaggiComesBack: Nestle restarts production at 3 units, may resume sales next month",2015-10-27,Neutral
Nestle India Ltd.,NESTLEIND,India sues Nestle for nearly $100m because lead shouldn't be in noodles.,2015-08-12,Neutral
Nestle India Ltd.,NESTLEIND,"Nestle takes Maggi off the shelves, says 'will be back in markets soon'",2015-06-05,Positive
Nestle India Ltd.,NESTLEIND,Class action against Nestle is shot in the dark; compromise is best option for all,2015-08-12,Neutral
Nestle India Ltd.,NESTLEIND,"Nestle withdraws Maggi from shelves, blames 'environment of confusion' in India",2015-06-05,Positive
Nestle India Ltd.,NESTLEIND,Trouble mounts for Nestle: Now Uttarakhand to test Maggi samples from Pantnagar unit,2015-06-01,Negative
Nestle India Ltd.,NESTLEIND,India seeks damages from Nestle after noodle scare - govt sources,2015-06-08,Positive
Oil & Natural Gas Corporation Ltd.,ONGC,"ONGC's Krishna-Godavari Basin Project To Boost India's Crude Oil Production, Annual Savings Of Rs 10,600 Crore Anticipated",2023-11-22,Neutral
Oil & Natural Gas Corporation Ltd.,ONGC,Iran has offered ONGC Videsh Ltd and its partners a 30 percent interest in the development of the Farzad-B gas field in the Persian Gulf that was discovered by the Indian consortium,2022-09-27,Positive
Oil & Natural Gas Corporation Ltd.,ONGC,The dubious appointments of Asthana in CBI and Sambit Patra in ONGC,2021-08-06,Neutral
Oil & Natural Gas Corporation Ltd.,ONGC,"Dharmendra Pradhan: Govt to auction 'major' oil, gas fields of ONGC, OIL",2021-06-11,Neutral
Oil & Natural Gas Corporation Ltd.,ONGC,"ONGC, barge contractor 'ignored' cyclone warnings, resulting in deaths of nearly 50 workers",2021-05-21,Positive
Oil & Natural Gas Corporation Ltd.,ONGC,"Three ONGC employees ‘abducted’ in Assam, ULFA-I suspected; ONGC said the employees were taken by ""unknown armed miscreants"" in a vehicle belonging to ONGC, which was later found abandoned near the Nimonagarh jungles, close to the Assam-Nagaland border.",2021-04-21,Neutral
Oil & Natural Gas Corporation Ltd.,ONGC,ONGC cash reserves erode 98% to Rs 167 cr in 1.5 years,2019-05-06,Negative
Oil & Natural Gas Corporation Ltd.,ONGC,"GSPC shows Rs 14,923 crore loss, will have to pay back over Rs 15,000 crore. This is why ONGC was armtwisted by Modiji into buying GSPC stake for 8000 Crore #GujaratModel",2018-02-26,Neutral
Oil & Natural Gas Corporation Ltd.,ONGC,PMK urges TN govt to stop Centre from issuing clearance for ONGC hydrocarbon projects,2019-06-27,Negative
Oil & Natural Gas Corporation Ltd.,ONGC,Cyclone Phethai Impact: Oil Rig Off Andhra Pradesh Coast Tilts; Indian Navy Aiding ONGC In Stabilisation Efforts,2018-12-22,Neutral
Oil & Natural Gas Corporation Ltd.,ONGC,Rajahmundry ONGC sets up nests to protect sparrows,2019-02-07,Negative
Oil & Natural Gas Corporation Ltd.,ONGC,CBI books officials of ONGC in Rs 80 cr scam case,2018-06-01,Neutral
Oil & Natural Gas Corporation Ltd.,ONGC,Cash-strapped Venezuela offers India's ONGC oil stake - reuters sources,2017-07-09,Neutral
Oil & Natural Gas Corporation Ltd.,ONGC,ONGC acquires 51.11% stake of President of India in Hindustan Petroleum Corporation Limited,2018-01-22,Positive
Oil & Natural Gas Corporation Ltd.,ONGC,Gas row: Reliance Industries faces $1 bn penalty in dispute with ONGC,2016-11-01,Negative
Oil & Natural Gas Corporation Ltd.,ONGC,No oil hunt in South China Sea without nod: Beijing to Delhi. India's ONGC Videsh Ltd is involved in oil and gas exploration in the exclusive economic zone and continental shelf of Vietnam.,2015-05-31,Neutral
Oil & Natural Gas Corporation Ltd.,ONGC,ONGC Videsh Ltd to stay put in South China Sea for strategic reasons,2016-08-26,Positive
Oil & Natural Gas Corporation Ltd.,ONGC,"Forget $8 proposed by RIL, ONGC asks for nearly $13 for deep-sea gas",2014-04-04,Neutral
Oil & Natural Gas Corporation Ltd.,ONGC,"Farmers find 'springs' in Thar desert. In October 2005, the ONGC Board had approved Rs1.7 crore for a pilot study to uncover the course of the Saraswati, the ""mighty river"" mentioned in the Rig Veda.",2016-04-27,Neutral
Oil & Natural Gas Corporation Ltd.,ONGC,ONGC Buys 15% Stake In Russia's top oil producer Vankor Oil Field For $1.35 Billion,2015-09-04,Positive
Oil & Natural Gas Corporation Ltd.,ONGC,"State-owned ONGC, IOC and OIL are among the five global companies named by the US administration for having energy ties with Iran, for which they can face sanctions by America.",2015-03-08,Neutral
Oil & Natural Gas Corporation Ltd.,ONGC,"ONGC plans to invest Rs 40,000 cr in KG oil, gas finds",2015-04-02,Neutral
Oil & Natural Gas Corporation Ltd.,ONGC,"government clears stake sale in Coal India, ONGC, NHPC; may get Rs 43000 crores",2014-09-11,Negative
Oil & Natural Gas Corporation Ltd.,ONGC,Government Closer to Selling a Stake in ONGC: Report,2014-10-20,Negative
Oil & Natural Gas Corporation Ltd.,ONGC,ONGC biggest gainer from govt’s decision to increase gas prices,2014-03-24,Positive
Reliance Industries Ltd.,RELIANCE,Soon these Companies/Individuals will be entering in a deal with Reliance~Jio,2024-07-12,Negative
Reliance Industries Ltd.,RELIANCE,Ambani Sharing Stage With Nvidia’s Huang Fails to Uplift Reliance Shares,2024-10-25,Neutral
Reliance Industries Ltd.,RELIANCE,"'Why is this quiet news?"" Anupam Mittal on Mukesh Ambani's Reliance laying off 42,000 employees. Modi's rajya",2024-08-13,Positive
Reliance Industries Ltd.,RELIANCE,"Indian conglomerate Reliance slashed over 42,000 jobs last financial year",2024-08-09,Neutral
Reliance Industries Ltd.,RELIANCE,Nothing just Reliance of peace spreading pece through blades .,2024-03-19,Neutral
Reliance Industries Ltd.,RELIANCE,Investigation raises questions on zoo transfers to Reliance-run Vantara,2024-07-13,Neutral
Reliance Industries Ltd.,RELIANCE,Shein to return to India? Reliance to launch Chinese fast-fashion label in coming weeks,2024-07-04,Neutral
Reliance Industries Ltd.,RELIANCE,Reliance Jio Announces Tariff Hike From July 3 & Unlimited 5G Data Plans: How Will This Effect You?,2024-06-27,Neutral
Reliance Industries Ltd.,RELIANCE,Narendra Modi model of self reliance,2023-02-27,Neutral
Reliance Industries Ltd.,RELIANCE,"Reliance Jio emerges as World's largest mobile operator in data traffic, surpassing China mobile",2024-04-26,Neutral
Reliance Industries Ltd.,RELIANCE,"Reliance acquisition reduced Disney's valuation by half to $4.5 billion, according to reports.",2024-01-31,Positive
Reliance Industries Ltd.,RELIANCE,Tesla is in talks with Reliance to set up an EV manufacturing arm in India,2024-04-11,Neutral
Reliance Industries Ltd.,RELIANCE,Impact of Reliance-Disney's massive $8.5 billion media joint venture is explained by experts.,2024-02-29,Positive
Reliance Industries Ltd.,RELIANCE,Reliance's market capitalization has crossed Rs 20 lakh crore.,2024-02-04,Neutral
Reliance Industries Ltd.,RELIANCE,"Before 2040, Reliance Industries' market capitalization is probably going to reach $1 trillion.",2024-02-17,Neutral
Reliance Industries Ltd.,RELIANCE,Reliance Industries is in talks to acquire Disney's share in Tata Play.,2024-02-16,Neutral
Reliance Industries Ltd.,RELIANCE,Adani Group enters into a no-poaching pact with Mukesh Ambani led Reliance Industries. A no-poaching agreement will prevent employees of both groups from joining each other.,2022-09-22,Negative
Reliance Industries Ltd.,RELIANCE,"Reliance's market capitalization now stands at ₹19.6 lakh crore, up ₹1 lakh crore.",2024-01-30,Neutral
Reliance Industries Ltd.,RELIANCE,Potential Disney-Reliance Merger Sparks Antitrust Concerns in India's Entertainment Industry,2023-12-16,Neutral
Reliance Industries Ltd.,RELIANCE,Reliance’s Interest to Acquire Israel's ‘Tower Semiconductor’,2023-10-19,Negative
Reliance Industries Ltd.,RELIANCE,"Reliance Retail Ventures gets Rs 2,000 crore from KKR",2023-09-12,Neutral
Reliance Industries Ltd.,RELIANCE,Apple moves iPhone production to India to reduce reliance on China,2023-08-17,Neutral
Reliance Industries Ltd.,RELIANCE,"14 Indo-Pacific Economic Framework nations agree to strengthen supply chains, cut reliance on China",2023-05-29,Negative
Reliance Industries Ltd.,RELIANCE,Reliance demerger: Jio Financial shares valued at Rs 261.85 apiece,2023-07-20,Negative
Reliance Industries Ltd.,RELIANCE,Reliance Capital lenders to vote on Hinduja arm resolution plan from today,2023-06-09,Positive
State Bank of India,SBIN,Crowds gathered to avail the benefits of 'Ladki Bahin Yojana' at SBI branch in Maharashtra,2024-08-23,Neutral
State Bank of India,SBIN,"How robbers tricked SBI ATM machine with 'Time Out' error to steal money - Two unidentified men have reportedly been accused of stealing Rs 2.52 lakh from an SBI ATM in Fort, Thiruvananthapuram, by manipulating the cash delivery system.",2024-11-23,Neutral
State Bank of India,SBIN,"RBI Has Declared These 3 Banks As The Safest In India - SBI, ICICI, HDFC",2024-11-15,Neutral
State Bank of India,SBIN,Fake SBI branch scams Chhattisgarh villagers of lakhs: Watch how it ran for days for days unnoticed,2024-10-05,Neutral
State Bank of India,SBIN,"After Fake SBI in Chhattisgarh, New Incident Highlights Fake Court Case in Gujarat",2024-10-22,Positive
State Bank of India,SBIN,Fake SBI branch scams Chhattisgarh villagers | India News - Times of India,2024-10-05,Neutral
State Bank of India,SBIN,Abhishek Bachchan gets 1800000 per month from SBI,2024-10-05,Neutral
State Bank of India,SBIN,"94% of agricultural & allied output out of MSP net, govt needs to find alternatives, says SBI report",2024-07-11,Positive
State Bank of India,SBIN,"Hyderabad SBI Branch Fraud: Rs 175 crore scam uncovered, ""mule accounts"" used for transactions",2024-09-03,Neutral
State Bank of India,SBIN,"No respite for loan borrowers! Home, car loan EMIs to rise further as SBI hikes MCLR",2024-06-16,Neutral
State Bank of India,SBIN,"SBI, ICICI Bank, Axis Bank, PNB, AU Small Finance Bank warn customers about banking frauds; different scams, ways to safeguard yourself",2024-05-23,Neutral
State Bank of India,SBIN,"SBI Q4 Net Profit Increased by 18.18% to Rs 21,384.15 Crore",2024-05-09,Negative
State Bank of India,SBIN,"Supreme Court pulls up SBI, tells it to disclose bond numbers linking donors &amp; parties | India News - Times of India",2024-03-16,Neutral
State Bank of India,SBIN,SBI says it is 'ready' with electoral bonds data as ordered by Supreme Court,2024-03-12,Neutral
State Bank of India,SBIN,SBI Submits Electoral Bond Details With Unique Numbers To EC: What's Revealed,2024-03-21,Neutral
State Bank of India,SBIN,"SC Directs SBI To Reveal Electoral Bond Alphanumeric Numbers, Urges Full Disclosure",2024-03-18,Positive
State Bank of India,SBIN,"CJI Slams SBI, Issues Notice; Why Bond No. Missing? #lawchakra #supremec...",2024-03-15,Neutral
State Bank of India,SBIN,SC Issues Notice To SBI For Disclosing Electoral Bond Number| Rajeev Kum...,2024-03-15,Neutral
State Bank of India,SBIN,SBI submits electoral bonds data to poll body day after Supreme Court rap,2024-03-12,Neutral
State Bank of India,SBIN,"Total Of 22,217 Electoral Bonds Purchased From Apr 1, 2019 To Feb 15, 2024: SBI Tells SC",2024-03-13,Negative
State Bank of India,SBIN,Electoral Bonds & SBI ; A twist in interpretation | Face to Face,2024-03-09,Neutral
