Company Name,Symbol,Headline,Publish Date,Sentiment
Hindustan Unilever Ltd.,HINDUNILVR,Unilever India CEO says his successor faces rush to tap giant market,2023-06-09,Positive
Hindustan Unilever Ltd.,HINDUNILVR,Ex-Unilever Marketing Executive talks about the anti-India propaganda in the top 5 international marketing agencies & requests PMO to investigate & penalise them.,2020-12-11,Negative
Hindustan Unilever Ltd.,HINDUNILVR,Indians are buying more Khadi than Hindustan Unilever products.,2019-08-16,Positive
Hindustan Unilever Ltd.,HINDUNILVR,"Hindustan Unilever to drop ""fair"" from ""fair & lovely"". Global equality movement in the after math of killing of Floyd reaches India as the company that own a popular beauty product in India says they are removing the words ‘fairness’, ‘whitening’ & ‘lightening’.",2020-06-25,Positive
Hindustan Unilever Ltd.,HINDUNILVR,"Hindustan Unilever: India’s consumption story losing the plot. Demand for cars, two-wheelers, air travel and consumer goods dropping to multi-quarter lows",2019-05-08,Neutral
Hindustan Unilever Ltd.,HINDUNILVR,GSK sold its Indian business to Unilever for 3.3 billion EUR,2020-05-07,Negative
Hindustan Unilever Ltd.,HINDUNILVR,Hindustan Unilever slapped Rs 380 crore fine by anti-profiteering body - Here are the findings of NAA,2018-12-25,Neutral
Hindustan Unilever Ltd.,HINDUNILVR,GST anti-profiteering authority slaps Rs 383 crore penalty on Hindustan Unilever,2018-12-25,Neutral
Hindustan Unilever Ltd.,HINDUNILVR,"Cargill, General Mills and Unilever agree to fortify flagship wheat flour brands with vitamins and minerals in India",2017-04-10,Neutral
Hindustan Unilever Ltd.,HINDUNILVR,Culture Machine & Ozontel make it to Unilever Foundry50 list,2015-06-17,Neutral
Hindustan Unilever Ltd.,HINDUNILVR,"[Shefali Vaidya] What is common in these four ads? The stereotype that Hindus are evil, close-minded and full of prejudices, but Muzlims are kind, good-hearted, open-minded and liberal. Thank you PoliticalKida for this compilation.",2020-10-14,Neutral
Hindustan Unilever Ltd.,HINDUNILVR,Indian Financial Sector,2019-11-07,Neutral
Hindustan Unilever Ltd.,HINDUNILVR,"Mahesh Murthy ""From college dropout to big entrepreneur"" will be doing an AMA on r/Indianews on Monday 23rd starting at 1pm IST.",2014-03-18,Positive
Hindustan Unilever Ltd.,HINDUNILVR,Indian Financial Sector,2019-06-30,Neutral
ICICI Bank Ltd.,ICICIBANK,"RBI Has Declared These 3 Banks As The Safest In India - SBI, ICICI, HDFC",2024-11-15,Neutral
ICICI Bank Ltd.,ICICIBANK,"madhabi puri buch: Congress accuses Madhabi Buch of conflict of interest, says she drew ICICI salary while at SEBI",2024-09-02,Neutral
ICICI Bank Ltd.,ICICIBANK,"SBI, ICICI Bank, Axis Bank, PNB, AU Small Finance Bank warn customers about banking frauds; different scams, ways to safeguard yourself",2024-05-23,Neutral
ICICI Bank Ltd.,ICICIBANK,ICICI: Indian woman alleges 'bank manager stole $1.9m from account',2024-03-02,Neutral
ICICI Bank Ltd.,ICICIBANK,'Ex-ICICI Bank CEO Kochhar got Rs 64 crore illegal gratification' | India News - Times of India,2023-06-27,Neutral
ICICI Bank Ltd.,ICICIBANK,"After CBI chargesheet, ICICI maintains Videocon loans caused no wrongful loss",2023-07-05,Negative
ICICI Bank Ltd.,ICICIBANK,ICICI Prudential gets notice for alleged GST liability of Rs 492 crore,2023-06-27,Neutral
ICICI Bank Ltd.,ICICIBANK,"ICICI Bank loan fraud: CBI files charge sheet against Kochhars, Venugopal Dhoot",2023-04-08,Neutral
ICICI Bank Ltd.,ICICIBANK,"Fraud outside HDFC, ICICI Bank in Jogeshwari, Mumbai Few men and burqa clad women stand outside ATM. Woman would beg for money for treatment of child from public. If the person refuses to give, men standing along will rough guy up saying he's molesting the women",2020-01-21,Neutral
ICICI Bank Ltd.,ICICIBANK,HDFC Bank's Puri top earner among bankers in FY21; ICICI Bank's Bakhshi forgoes salary in COVID year,2021-07-26,Positive
ICICI Bank Ltd.,ICICIBANK,"""What is Videocon ICICI Bank’s Loan Fraud and it's connection to Bollywood?",2021-01-08,Neutral
ICICI Bank Ltd.,ICICIBANK,Enforcement Directorate has attached properties of former MD & CEO of ICICI Bank Chanda Kochhar and her family. Total assets worth Rs. 78 crore (book value) have been attached. This includes her flat in Mumbai and some properties of the company of his husband.,2020-01-10,Neutral
ICICI Bank Ltd.,ICICIBANK,ICICI Bank-Videocon case: ED arrests Deepak Kochhar on charges of money laundering,2020-09-07,Negative
ICICI Bank Ltd.,ICICIBANK,"IBC's big success: Lenders to recover Rs 42k crore as ArcelorMittal initiates payment for Essar Steel; SBI to write BACK Rs 12,161 core, Canara Bank Rs 3,493 crore, PNB Rs 2,701 crore and ICICI Rs 2,110 crore from this; Essar Steel was in the first list of 12 biggest NPAs that the RBI made in 2017",2019-12-14,Neutral
ICICI Bank Ltd.,ICICIBANK,"ICICI BANK TO SHIFT HQ FROM VADODARA TO MUMBAI. With this move, Gujarat is expected to lose on its share of corporate tax and stamp duty on large loans provided by the bank",2020-05-10,Neutral
ICICI Bank Ltd.,ICICIBANK,Why is CBI under Amit Shah not filing a charge sheet against NDTV’s Prannoy Roy and wife after three years in the ICICI Bank loan fraud case?,2020-06-26,Positive
ICICI Bank Ltd.,ICICIBANK,"The downgrade of SBI, Bank of Baroda, and ICICI Bank is proof that the 'biggest nightmare' for India's financial sector is becoming real",2020-05-07,Negative
ICICI Bank Ltd.,ICICIBANK,How was the former ICICI Bank head Chanda Kochhar caught for her sins? Who all tried to save her?,2020-01-12,Neutral
ICICI Bank Ltd.,ICICIBANK,Bombay HC dismisses Chanda Kochhar’s petition challenging her termination as MD and CEO of ICICI Bank,2020-03-07,Neutral
ICICI Bank Ltd.,ICICIBANK,"Amid lacklustre demand from infra sector, ICICI Bank shuts project financing division; Banks are baulking at funding infrastructure projects due to asset-liability mismatches, delays in statutory clearances, and bad loans.",2019-11-06,Positive
ICICI Bank Ltd.,ICICIBANK,Chanda Kochhar moves Bombay HC against her termination from ICICI - Times of India,2019-11-30,Neutral
ICICI Bank Ltd.,ICICIBANK,"ED attaches Rs 78 crore worth assets of Chanda Kochhar, others - ICICI- Times of India ►",2020-01-10,Neutral
ICICI Bank Ltd.,ICICIBANK,"From October 16, ICICI to levy ‘zero’ a/c holders Rs 125 per transaction - Times of India",2019-09-15,Neutral
ICICI Bank Ltd.,ICICIBANK,"ICICI Bank: BYI says Deepak Kochhar account records lost in natural calamity, ICICI probe is now a wild goose chase",2019-04-10,Positive
ICICI Bank Ltd.,ICICIBANK,"Fitch downgrades credit ratings of ICICI Bank, Axis Bank to junk status. The one-notch downgrade of ICICI Bank, Fitch said, reflects its assessment of India’s operating environment",2019-06-05,Neutral
ITC Ltd.,ITC,Illegal possession on Govt land behind ITC ROYAL BENGAL & MARRIOTT by peacefuls,2024-03-14,Neutral
ITC Ltd.,ITC,"TIL, Narendra Modi govt currently holds ""7.86%"" in ITC (Indian Tobacco Company).. How Auspicious!",2023-02-07,Neutral
ITC Ltd.,ITC,"BAT to sell 3.5% stake in ITC for Rs 16,775 crore in year's biggest block trade",2024-03-13,Neutral
ITC Ltd.,ITC,"FMCG business brings in Rs 29,000 crore for ITC amid surging consumer spends",2023-06-15,Neutral
ITC Ltd.,ITC,ITC becomes 11th Indian firm to cross Rs 5-trillion market value,2023-04-20,Neutral
ITC Ltd.,ITC,ITC shares finally find another boost after q3 earnings...,2023-03-06,Negative
ITC Ltd.,ITC,ITC: ITC investors' patience may be finally paying off,2022-07-04,Neutral
ITC Ltd.,ITC,"Great Indian wheat export mystery: Turkey didn’t reject for quality, Israel bought it, ITC says",2022-06-10,Neutral
ITC Ltd.,ITC,"itc: Suppliers in spot as ITC, Cargill cancel wheat buying contracts",2022-05-24,Neutral
ITC Ltd.,ITC,Model to get Rs 2 crore compensation from Hotel ITC Maurya for haircut gone wrong,2021-09-24,Neutral
ITC Ltd.,ITC,ITC: ITC's alignment with healthcare's a global trend it needs to deepen,2021-11-26,Neutral
ITC Ltd.,ITC,ITC to acquire 16% stake in Mother Sparsh for Rs 20 crore,2021-11-26,Neutral
ITC Ltd.,ITC,ITC: ITC surges 7% and opens the way for 15% more upside,2021-09-17,Positive
ITC Ltd.,ITC,"ITC’s net profit jumps by 36% to ₹4,023 crore on tax credit",2019-10-25,Positive
ITC Ltd.,ITC,ITC Launches World’s Most Expensive Chocolate At Rs 4.3 Lakh/Kg,2019-10-23,Neutral
ITC Ltd.,ITC,"ITC, Tatas, others tapped for J&K’s first investors summit: Government also plans to bring in investors from Middle East, Malaysia and Singapore.",2019-08-07,Negative
ITC Ltd.,ITC,GST India News releases 12 points ITC checklist for taxpayers before filing GSTR 9 on 31.08.2019 due to its last date..Here is the link..,2019-08-24,Neutral
ITC Ltd.,ITC,ITC: How ITC smoke choked market,2017-07-19,Neutral
ITC Ltd.,ITC,"ITC plans to set up multi-speciality hospitals: The board of directors has recommended entering health sector by setting up state of the art world class multi-speciality hospitals, ITC said in a notice to shareholders",2017-02-11,Neutral
ITC Ltd.,ITC,Infosys Ltd set to beat ITC Ltd with biggest weighting on BSE Sensex,2013-12-20,Neutral
ITC Ltd.,ITC,"TCS, ITC biggest wealth creators during 2008-2013: Study",2013-12-13,Neutral
ITC Ltd.,ITC,"TCS, ITC biggest wealth creators during 2008-2013: Study",2013-12-13,Neutral
ITC Ltd.,ITC,Hamari ladki lasko se kam hai ke !,2024-06-11,Neutral
ITC Ltd.,ITC,"On a post about an ad during super bowl in world news, a comment explaining why we need farm laws was deleted, the comment was among the top 5 and had received several awards.",2021-02-08,Neutral
ITC Ltd.,ITC,"By2026, India's first domestic chip could be released at Tata's Dholera semiconductor plant: Report",2024-03-14,Neutral
IndusInd Bank Ltd.,INDUSINDBK,RBI OKs Hinduja hiking IndusInd Bank stake,2023-02-03,Positive
IndusInd Bank Ltd.,INDUSINDBK,"Reliance Capital: Piramal, IndusInd, Oaktree and Cosmea mull bid for Reliance Capital",2022-07-20,Neutral
IndusInd Bank Ltd.,INDUSINDBK,"Zee Business Exclusive: IL&FS to pay Rs 16,000 cr dues to SBI, PNB, Canara Bank, Indusind Bank; Anil Singhvi calls this a big development",2022-01-29,Neutral
IndusInd Bank Ltd.,INDUSINDBK,"kotak mahindra bank: Citi consumer business: Kotak Mahindra, Axis and IndusInd submit bids",2021-10-27,Negative
IndusInd Bank Ltd.,INDUSINDBK,Reliance communications: Reliance Communications Enterprises pledges 12.50 crore shares of RCom with IndusInd Bank; RCE held 49.06 crore shares in RCom amounting to 17.74 per cent stake.,2019-03-25,Positive
IndusInd Bank Ltd.,INDUSINDBK,Shareholders of Bharat Financial (formerly SKS Microfinance) will meet over merger with IndusInd Bank next month,2018-11-10,Neutral
IndusInd Bank Ltd.,INDUSINDBK,IndusInd Bank Ltd profit may beat estimates: StarMine,2014-01-09,Positive
IndusInd Bank Ltd.,INDUSINDBK,Indian Financial Sector,2019-11-07,Positive
IndusInd Bank Ltd.,INDUSINDBK,Indian Financial Sector Daily Update,2019-04-06,Neutral
IndusInd Bank Ltd.,INDUSINDBK,Indian Financial Sector,2019-11-02,Neutral
IndusInd Bank Ltd.,INDUSINDBK,Indian Financial Sector,2019-10-31,Negative
IndusInd Bank Ltd.,INDUSINDBK,Indian Financial Sector,2019-10-06,Neutral
IndusInd Bank Ltd.,INDUSINDBK,Indian Financial Sector,2019-09-16,Neutral
IndusInd Bank Ltd.,INDUSINDBK,Indian Financial Sector,2019-10-10,Positive
IndusInd Bank Ltd.,INDUSINDBK,Indian Financial Sector,2019-09-19,Positive
IndusInd Bank Ltd.,INDUSINDBK,Indian Financial Sector,2019-07-15,Positive
IndusInd Bank Ltd.,INDUSINDBK,Indian Financial Sector,2019-07-23,Positive
IndusInd Bank Ltd.,INDUSINDBK,Indian Financial Sector,2019-07-12,Neutral
IndusInd Bank Ltd.,INDUSINDBK,Indian Financial Sector,2019-06-28,Negative
IndusInd Bank Ltd.,INDUSINDBK,Indian Financial Sector,2019-06-23,Neutral
IndusInd Bank Ltd.,INDUSINDBK,Indian Financial Sector,2019-05-22,Positive
IndusInd Bank Ltd.,INDUSINDBK,Indian Financial Sector,2019-06-19,Neutral
IndusInd Bank Ltd.,INDUSINDBK,Indian Financial Sector,2019-06-14,Neutral
IndusInd Bank Ltd.,INDUSINDBK,Indian Financial Sector,2019-04-23,Neutral
Infosys Ltd.,INFY,"India’s youth held back for 1,000 years by invasions and colonial rule, says Infosys founder Narayana Murthy",2024-11-15,Neutral
Infosys Ltd.,INFY,Employee union president to Infosys: âwill not hesitate to organize a protestâ..if joining date is breached - Times of India,2024-09-04,Negative
Infosys Ltd.,INFY,"Infosys under investigation for GST evasion of over Rs 32,000 crore",2024-07-31,Negative
Infosys Ltd.,INFY,"Infosys terms Rs 32,000 crore GST refund notice 'pre-show cause': Read company's letter to BSE - Times of India",2024-08-01,Negative
Infosys Ltd.,INFY,"Infosys settles insider trading charges with SEBI, to pay ₹25 lakh fine | Mint",2024-06-29,Neutral
Infosys Ltd.,INFY,How cybercriminals extorted Rs 3.7 crore from Infosys employee in elaborate scam,2024-05-06,Neutral
Infosys Ltd.,INFY,Ashoka University Row: Students Raises Casteist Slogans Inside Campus; Former Infosys CFO Reacts,2024-03-28,Neutral
Infosys Ltd.,INFY,"BofA, Fidelity and TIAA get hit by ransomware attack on Infosys",2024-03-15,Negative
Infosys Ltd.,INFY,Karnataka's opposition leader accuses Infosys of betrayal at its best | - Times of India,2024-02-16,Neutral
Infosys Ltd.,INFY,"Suing ex-employees, sending legal notice: Here is what is going on between Cognizant, Infosys and Wipro",2024-01-04,Neutral
Infosys Ltd.,INFY,Infosys Ends Ties with Australian Lobbying Firm Synergy 360 - Equitypandit,2023-07-31,Neutral
Infosys Ltd.,INFY,Infosys signs five-year AI deal with $2 billion target spend,2023-07-18,Negative
Infosys Ltd.,INFY,Infosys fires 600 freshers after they fail internal assessment: Report,2023-02-11,Neutral
Infosys Ltd.,INFY,Infosys announces Kiran Mazumdar-Shaw's retirement from board; Sundaram named lead independent director - Times of India,2023-03-23,Neutral
Infosys Ltd.,INFY,Infosys की Sudha Murthy ने Modi से पूछा प्रेरणा का स्त्रोत तो PM ने दिया...,2023-04-11,Negative
Infosys Ltd.,INFY,"Opposition pressures UK PM Rishi Sunak over wife Akshata’s business interest; Akshata Murty, the daughter of Infosys co-founder Narayana Murthy, is listed as a shareholder in Koru Kids Ltd which is likely to benefit from a new pilot scheme announced in the Spring Budget",2023-04-01,Neutral
Infosys Ltd.,INFY,"Infosys asks HR not to hire 'Indian-origin candidates, women with kids';",2022-10-13,Positive
Infosys Ltd.,INFY,Our work culture is the reason we've not progressed: Infosys co-founder NR Narayana Murthy,2020-01-07,Positive
Infosys Ltd.,INFY,Every downturn is actually a boon for Indian software companies: Infosys founder Narayana Murthy - Times of India,2023-02-21,Neutral
Infosys Ltd.,INFY,"Layoffs hit TCS, Infosys, Tech Mahindra: Is your job at risk? I Watch",2023-02-11,Neutral
Infosys Ltd.,INFY,"SC Committee to investigate Adani, includes 2 Infosys members & Somasekhar Sundaresan-board member of Oxfam. Same Oxfam running activism against Adani in Australia.Oxfam is directly funded by Soros, Rockefeller,Gates & other elites.Last week Soros said openly that he wants regime change in India.",2023-03-03,Neutral
Infosys Ltd.,INFY,Infosys acknowledges £20m tax dispute with HMRC,2023-02-03,Neutral
Infosys Ltd.,INFY,"Infosys follows Wipro, asks freshers who fail test to exit - Times of India",2023-02-11,Neutral
Infosys Ltd.,INFY,"Can Ather Industries, Anumpam Rasayan prove to be the next Infosys? Vinit Bolinjkar answers",2022-12-15,Neutral
Infosys Ltd.,INFY,Infosys to roll out 65% variable pay for Q2,2022-11-17,Negative
JSW Steel Ltd.,JSWSTEEL,JSW Steel trialling largest blast furnace CCUS project in Indian steel industry. BigMint reports,2024-10-24,Positive
JSW Steel Ltd.,JSWSTEEL,"JSW and MG Motor India join hands, plan to launch a new car every 3-6 months",2024-03-21,Neutral
JSW Steel Ltd.,JSWSTEEL,JSW Steel in talks to buy 20% in Australian coal mine for $1 billion,2024-02-20,Neutral
JSW Steel Ltd.,JSWSTEEL,"TPG, Tepco, Brookfield in talks for JSW Neo stake",2023-09-11,Neutral
JSW Steel Ltd.,JSWSTEEL,"TPG, Tepco, Brookfield in talks for JSW Neo stake",2023-09-11,Neutral
JSW Steel Ltd.,JSWSTEEL,"Holcim Group: Holcim deal talks with Adani, JSW enter last leg",2022-05-10,Negative
JSW Steel Ltd.,JSWSTEEL,JSW Group: JSW taps Carlyle to back bid for Holcim's Indian cement operations,2022-04-21,Negative
JSW Steel Ltd.,JSWSTEEL,"Jagatsinghpur, Odisha | Police baton-charged over 500 people in the Dhinkia village who were allegedly protesting over the proposed JSW steel plant site in the district, today. Communists also involved.",2022-01-17,Neutral
JSW Steel Ltd.,JSWSTEEL,"JSW Group to set up Rs 150-cr steel unit in J&K. This facility will be set up with an investment of around Rs 150 crore at Lassipora, Pulwama in Kashmir.",2021-10-26,Negative
JSW Steel Ltd.,JSWSTEEL,JSW Group to boycott $400 million imports from China: Parth Jindal,2020-07-05,Neutral
JSW Steel Ltd.,JSWSTEEL,"NCLAT upholds JSW Steel Resolution Plan for Bhushan Power & Steel, declares attachment of property by ED as illegal",2020-02-17,Negative
JSW Steel Ltd.,JSWSTEEL,Trump effect: JSW to invest upto $500 million in US,2018-03-27,Positive
JSW Steel Ltd.,JSWSTEEL,Vinesh Phogat has been disqualified from the women's wrestling 50kg event for being above the weight limit at today's weigh-in.,2024-08-07,Positive
JSW Steel Ltd.,JSWSTEEL,JSW Steel’s main plant battling iron ore shortage,2013-12-18,Neutral
JSW Steel Ltd.,JSWSTEEL,25m Pistol | Manu bhaker going for third medal don't miss to watch on 1:00 PM at Olympics #manubhaker #olympics,2024-08-02,Positive
JSW Steel Ltd.,JSWSTEEL,Aman Sehrawat wins Bronze in Men's 57kg - Wrestling and wins India's sixth medal at the Paris Olympics.,2024-08-09,Negative
JSW Steel Ltd.,JSWSTEEL,"Paris Olympics 2024 | Defending champion Neeraj Chopra qualifies for the final of Men's javelin throw in the first attempt, with a throw of 89.34 metres.",2024-08-06,Negative
JSW Steel Ltd.,JSWSTEEL,The RBI allows LIC to acquire up to a 9.99% stake in HDFC Bank.,2024-01-29,Neutral
JSW Steel Ltd.,JSWSTEEL,Power Sector - Just one example in which the NDA has massively outperformed the extremely inefficient UPA.,2017-09-27,Positive
Kotak Mahindra Bank Ltd.,KOTAKBANK,"RBI cracks down on Kotak Mahindra Bank; bars onboarding new customers through online, mobile banking and issuing new credit cards",2024-04-25,Positive
Kotak Mahindra Bank Ltd.,KOTAKBANK,Indian stock markets nowhere near bubble territory: Uday Kotak,2024-03-16,Neutral
Kotak Mahindra Bank Ltd.,KOTAKBANK,"Uday Kotak: US dollar is the biggest financial terrorist in the world. ""All our money is in nostro accounts and somebody in the US can say- you cannot withdraw it from tomorrow morning- and you are stuck,"" said Kotak, highlighting the perils of dependence on US dollars.",2023-04-30,Neutral
Kotak Mahindra Bank Ltd.,KOTAKBANK,"Election results to impact price performance over next 12-18 months: Nilesh Shah, Kotak AMC",2023-05-28,Neutral
Kotak Mahindra Bank Ltd.,KOTAKBANK,"Financial terrorist: Uday Kotak ‘corrects’ previous statement, explains on Twitter what he actually meant; Uday Kotak earlier called the US dollar the ‘biggest financial terrorist in the world’.",2023-05-01,Neutral
Kotak Mahindra Bank Ltd.,KOTAKBANK,Uday Kotak to transition to non-executive role after CEO tenure at Kotak Mahindra Bank,2023-04-23,Neutral
Kotak Mahindra Bank Ltd.,KOTAKBANK,Kotak Bank taps consulting firm Egon Zehnder to replace CEO Uday Kotak,2023-02-21,Neutral
Kotak Mahindra Bank Ltd.,KOTAKBANK,"Kotak Mahindra | Axis Bank | HDFC Bank : After Axis and HDFC Bank, will Kotak Mahindra go the M&A way?",2022-04-06,Positive
Kotak Mahindra Bank Ltd.,KOTAKBANK,"Legal tussle between Grover, Kotak Wealth not over yet",2022-03-04,Neutral
Kotak Mahindra Bank Ltd.,KOTAKBANK,"axis bank: Citi's India retail business: Kotak, Axis Bank lead race",2021-12-07,Neutral
Kotak Mahindra Bank Ltd.,KOTAKBANK,"kotak mahindra bank: Citi consumer business: Kotak Mahindra, Axis and IndusInd submit bids",2021-10-27,Negative
Kotak Mahindra Bank Ltd.,KOTAKBANK,Citibank India: 5 lenders including HDFC Bank and Kotak in race for Citi India’s retail business,2021-08-10,Neutral
Kotak Mahindra Bank Ltd.,KOTAKBANK,Customer-focus and digital-first are the keys to survival and growth: Uday Kotak,2021-07-30,Positive
Kotak Mahindra Bank Ltd.,KOTAKBANK,"covid second wave | uday kotak: Need highest level response, curtailment of economic activity to control second wave of Covid-19: Uday Kotak",2021-05-03,Positive
Kotak Mahindra Bank Ltd.,KOTAKBANK,"Uday Kotak deconstructs the story behind China's slow, systematic capture of India's markets",2020-08-17,Negative
Kotak Mahindra Bank Ltd.,KOTAKBANK,"Attention students, job seekers: Advice from self-made billionaire Uday Kotak",2020-06-09,Negative
Kotak Mahindra Bank Ltd.,KOTAKBANK,"Interview with Uday Kotak: ‘Massive amount of Indian savers' money is now going into few hundred stocks’; Uday Kotak said four out of five top private banks are majority owned foreigners, benefiting foreign savers.",2018-01-15,Neutral
Kotak Mahindra Bank Ltd.,KOTAKBANK,"Demonetization impact would be positive if there were no Rs 2,000 notes: Uday Kotak",2018-12-13,Negative
Kotak Mahindra Bank Ltd.,KOTAKBANK,"Government takes control of IL&FS, forms 6-member board led by Uday Kotak",2018-10-02,Neutral
Kotak Mahindra Bank Ltd.,KOTAKBANK,"Buffett's Berkshire Eyes Stake in India's Kotak Mahindra Bank, KMBL says it's unaware of any plans.",2018-12-11,Positive
Kotak Mahindra Bank Ltd.,KOTAKBANK,Opinion| Can the RBI and Kotak Mahindra Bank both be right?,2019-01-23,Neutral
Kotak Mahindra Bank Ltd.,KOTAKBANK,Bombay High Court Refuses Interim Relief For Kotak Mahindra Bank On RBI Deadline To Cut Promoter Stake,2018-12-18,Neutral
Kotak Mahindra Bank Ltd.,KOTAKBANK,Yes Bank lawyer alleges that Kotak Mahindra Bank behind is negative news coverage of Yes Bank,2018-12-07,Positive
Kotak Mahindra Bank Ltd.,KOTAKBANK,"Kotak Bank, ICICI to offer banking on WhatsApp - Times of India",2018-06-06,Neutral
Kotak Mahindra Bank Ltd.,KOTAKBANK,"Only five large banks can survive in the long-term, says Uday Kotak. Uday Kotak declined to specify the names of five banks but said State Bank of India will be one among them",2017-04-05,Negative
Larsen & Toubro Ltd.,LT,Congress lured her into politics but later gave her a massive L,2024-04-29,Neutral
Larsen & Toubro Ltd.,LT,"The demographic change is rea.l... Manglaur (Uttarakhand) has 90% Muslim population, Congress's Qazi Md Nizamuddin is the MLA from this area. His supporters attacked Hindu families just because they feel this area belongs to them now..",2024-07-15,Neutral
Larsen & Toubro Ltd.,LT,Common Pakistani L,2022-09-27,Negative
Larsen & Toubro Ltd.,LT,"lIT-Guwahati student Tauseef Ali Farooqi, a fourth semester biotech student - justifying his allegiance to join ISIS. You think making them educated would Change something",2024-03-24,Neutral
Larsen & Toubro Ltd.,LT,"Canada के विपक्ष का हिंदुओं को ""दिवाली तोहफा"" ! अगला जवाब अमित शाह का! L...",2024-10-31,Negative
Larsen & Toubro Ltd.,LT,POK पे मोदी का Grand Plan l कश्मीर & अब्दुल्लाह,2024-10-20,Neutral
Larsen & Toubro Ltd.,LT,"L&T joins semiconductor bandwagon, plans to become fabless chipmaker with $300-mn investment",2024-09-11,Neutral
Larsen & Toubro Ltd.,LT,Sadhguru’s POWERFUL WARNING to the Nation | SAVE INDIA Before It's Too L...,2024-09-21,Neutral
Larsen & Toubro Ltd.,LT,"L&T Semiconductor Technologies a pioneer in indigenous semiconductor design & development, has entered a partnership with the IIT Gandhinagar, for joint development of secure Integrated Circuits (IC) and System-on-Chips (SoC) projects of national importance.",2024-08-30,Neutral
Larsen & Toubro Ltd.,LT,Home Ministry decision to grant more power to J&K L-G sparks opposition outcry,2024-07-16,Negative
Larsen & Toubro Ltd.,LT,"Delhi tree felling case: What happened during L-G visit… there is cover-up, says top court",2024-07-13,Neutral
Larsen & Toubro Ltd.,LT,Targeted killing of Kashmiri Pandits should not be seen from prism of religion: L-G Manoj Sinha,2022-12-26,Neutral
Larsen & Toubro Ltd.,LT,L&T ने बनाई नई टेक्नोलॉजी | L&T Manufactures Hydrotreating Reactor for R...,2024-04-27,Neutral
Larsen & Toubro Ltd.,LT,"5 soldiers lost their lives in an explosion during an encounter with terrorists in Rajouri yesterday. Hav Neelam Singh, Nk Arvind Kumar, L/Nk RS Rawat, Ptr Pramod Negi & Ptr S Chettri are the fallen heroes. Jammu and Kashmir LG Manoj Sinha pays tribute to five Army personnel.",2023-05-06,Neutral
Larsen & Toubro Ltd.,LT,LIVE: “Hum Modi ji nahi de sakte” EAM Jaishankar's funny reply to Arab l...,2024-02-29,Neutral
Larsen & Toubro Ltd.,LT,Aditya L-1: India's Mission to Study the Sun 🌞,2023-09-01,Neutral
Larsen & Toubro Ltd.,LT,"Telangana: Revanth Reddy Slams Brakes On Hyderabad Airport Metro, Orders Probe Into Preferential Treatment Given To L&T",2023-12-16,Neutral
Larsen & Toubro Ltd.,LT,"Worked 15 hrs a day, slept on office table after long work days at L&T: A M Naik",2023-11-05,Neutral
Larsen & Toubro Ltd.,LT,"Kejriwal sends Atishi’s preliminary report against Delhi Chief Secy to L-G, recommends suspension - US News Insight",2023-11-15,Positive
Larsen & Toubro Ltd.,LT,"UK 🇬🇧: Alamin Shanur, a Bangladeshi muslim migrant online groomed a British child; sent her several obscene video & photo Caught & handed over to police by Cobra Hunters UK (a child protection agency), when He facilitated a meet to the child with s*xu*l intention.",2023-10-02,Neutral
