Company Name,Symbol,Headline,Publish Date,Sentiment
Adani Enterprises Ltd.,ADANIENT,"Adani Group warns Bangladesh to pay ₹7,200 crore by Nov 7 or risk power supply disruption from the Godda plant, which provides 10% of the country's electricity.",2024-11-04,Positive
Adani Enterprises Ltd.,ADANIENT,All states involved in $250 mn Adani bribery charges were opposition-ruled: BJP,2024-11-21,Positive
Adani Enterprises Ltd.,ADANIENT,Adani is not India but he is an Indian. Therefore I will trust his version more than a foreign research firm with business interest. If Adani has committed fraud then competent legal authority will decide on it after investigation not a foreign research firm.,2023-01-31,Negative
Adani Enterprises Ltd.,ADANIENT,Indian tycoon Adani takes over school from Catholic nuns. The billionaire businessman's foundation has been told to remove 'Mount Carmel' from the school’s name.,2024-10-02,Neutral
Adani Enterprises Ltd.,ADANIENT,Adani Group acquires 49% stake in Quint Media.,2022-05-15,Neutral
Adani Enterprises Ltd.,ADANIENT,"Indian state govts trying to woo Elon Musk for proposed Tesla facility - Punjab(sabotaging Jio/Adani infra), Tamil Nadu (shut down Sterlite, troubled Foxconn), West Bengal (abandoned Tata Motors facility, rampant anti business environment for more 60 years)",2022-01-17,Neutral
Adani Enterprises Ltd.,ADANIENT,Why Khangress has problem with Adani & Ambani,2024-02-26,Negative
Adani Enterprises Ltd.,ADANIENT,"While pappu criticizes modi-adani ties,many Congress-ruled states are drawing thousands of crores in investments from Adani",2024-06-30,Neutral
Adani Enterprises Ltd.,ADANIENT,"Fodder Scam Convict, Lalu Yadav: Rahul Gandhi (National Herald Scam + POSCO case accused) is right, Adani should be arrested immediately. Should Central Govt arrest Adani and all the CMs indicted in the US?",2024-11-22,Negative
Adani Enterprises Ltd.,ADANIENT,Masterstroke by Gautam Adani as Ambuja Cements becomes first company in world to achieve net-zero emissions by 2050.,2024-09-28,Neutral
Adani Enterprises Ltd.,ADANIENT,Adani group acquires 29.18% stake in NDTV and launch opening offer for acquiring additional 26% stake.,2022-08-23,Negative
Adani Enterprises Ltd.,ADANIENT,Opposition states named in Adani bribery charge: BJP hits back at Rahul Gandhi,2024-11-21,Positive
Adani Enterprises Ltd.,ADANIENT,"Kerala GST body slaps taxes on Adani’s Thiruvananthapuram airport pact, goes against Rajasthan and Gujarat appellate authority rulings.",2024-11-11,Negative
Adani Enterprises Ltd.,ADANIENT,"Should we support rahul & arrest Adani, Rahul urf raga, Stalin, Didi, Bhagel, Gehlot, Reddy & all the other CM, FM & HM, etc etc whose names are in the report & those who got kickbacks from the 3,00,000+ CRORE worth schemes Adani launched in Opp states? JPC should investigate rahuls link with Adani?",2024-11-21,Positive
Adani Enterprises Ltd.,ADANIENT,Bears May Double Down on Bets Against Adani Group Stocks After US Bribery Charges,2024-11-21,Positive
Adani Enterprises Ltd.,ADANIENT,Adani group cuts electricity supply to Bangladesh by half,2024-11-02,Neutral
Adani Enterprises Ltd.,ADANIENT,Adani Enterprises Share Price: Sharp Decline as US Bribery Allegations Emerge,2024-11-21,Positive
Adani Enterprises Ltd.,ADANIENT,Rahul Gandhi calls for Gautam Adani's immediate arrest after billionaire indicted by US,2024-11-21,Positive
Adani Enterprises Ltd.,ADANIENT,"US Deep State FEELS THREATENED by Powerful India, Growing Military Prowess and Adani Group’s ambitious international infrastructure projects. When you can't beat them, indict them!!",2024-11-22,Negative
Adani Enterprises Ltd.,ADANIENT,Green Energy Stocks Turn Red as Adani Probe Adds to Investors’ India Challenges,2024-11-22,Negative
Adani Enterprises Ltd.,ADANIENT,"This is getting ridiculous. What next? Being slaves of Ambani, Adani essential for survival of Hinduism??",2024-06-22,Neutral
Adani Enterprises Ltd.,ADANIENT,Who is Breon Peace? Understanding connection between Gautam Adani's federal prosecutor and George Soros' family,2024-11-21,Positive
Adani Enterprises Ltd.,ADANIENT,Indian billionaire Gautam Adani charged in US over alleged $250mn bribery scheme. Prosecutors accuse tycoon and others of lying to investors and offering millions in bribes to land lucrative contracts,2024-11-21,Positive
Adani Enterprises Ltd.,ADANIENT,Indian billionaire Adani accused of bribery,2024-11-21,Positive
Adani Enterprises Ltd.,ADANIENT,"Adani's Business On Indian Soil Is None of America or Its Deep State's Concern, Says Arnab",2024-11-22,Negative
Adani Ports and Special Economic Zone Ltd.,ADANIPORTS,"Adani Group warns Bangladesh to pay ₹7,200 crore by Nov 7 or risk power supply disruption from the Godda plant, which provides 10% of the country's electricity.",2024-11-04,Positive
Adani Ports and Special Economic Zone Ltd.,ADANIPORTS,All states involved in $250 mn Adani bribery charges were opposition-ruled: BJP,2024-11-21,Positive
Adani Ports and Special Economic Zone Ltd.,ADANIPORTS,Adani is not India but he is an Indian. Therefore I will trust his version more than a foreign research firm with business interest. If Adani has committed fraud then competent legal authority will decide on it after investigation not a foreign research firm.,2023-01-31,Negative
Adani Ports and Special Economic Zone Ltd.,ADANIPORTS,Indian tycoon Adani takes over school from Catholic nuns. The billionaire businessman's foundation has been told to remove 'Mount Carmel' from the school’s name.,2024-10-02,Neutral
Adani Ports and Special Economic Zone Ltd.,ADANIPORTS,Adani Group acquires 49% stake in Quint Media.,2022-05-15,Neutral
Adani Ports and Special Economic Zone Ltd.,ADANIPORTS,"Indian state govts trying to woo Elon Musk for proposed Tesla facility - Punjab(sabotaging Jio/Adani infra), Tamil Nadu (shut down Sterlite, troubled Foxconn), West Bengal (abandoned Tata Motors facility, rampant anti business environment for more 60 years)",2022-01-17,Negative
Adani Ports and Special Economic Zone Ltd.,ADANIPORTS,Why Khangress has problem with Adani & Ambani,2024-02-26,Negative
Adani Ports and Special Economic Zone Ltd.,ADANIPORTS,"While pappu criticizes modi-adani ties,many Congress-ruled states are drawing thousands of crores in investments from Adani",2024-06-30,Neutral
Adani Ports and Special Economic Zone Ltd.,ADANIPORTS,"Fodder Scam Convict, Lalu Yadav: Rahul Gandhi (National Herald Scam + POSCO case accused) is right, Adani should be arrested immediately. Should Central Govt arrest Adani and all the CMs indicted in the US?",2024-11-22,Negative
Adani Ports and Special Economic Zone Ltd.,ADANIPORTS,Masterstroke by Gautam Adani as Ambuja Cements becomes first company in world to achieve net-zero emissions by 2050.,2024-09-28,Neutral
Adani Ports and Special Economic Zone Ltd.,ADANIPORTS,Adani group acquires 29.18% stake in NDTV and launch opening offer for acquiring additional 26% stake.,2022-08-23,Negative
Adani Ports and Special Economic Zone Ltd.,ADANIPORTS,Opposition states named in Adani bribery charge: BJP hits back at Rahul Gandhi,2024-11-21,Positive
Adani Ports and Special Economic Zone Ltd.,ADANIPORTS,"Kerala GST body slaps taxes on Adani’s Thiruvananthapuram airport pact, goes against Rajasthan and Gujarat appellate authority rulings.",2024-11-11,Negative
Adani Ports and Special Economic Zone Ltd.,ADANIPORTS,"Should we support rahul & arrest Adani, Rahul urf raga, Stalin, Didi, Bhagel, Gehlot, Reddy & all the other CM, FM & HM, etc etc whose names are in the report & those who got kickbacks from the 3,00,000+ CRORE worth schemes Adani launched in Opp states? JPC should investigate rahuls link with Adani?",2024-11-21,Positive
Adani Ports and Special Economic Zone Ltd.,ADANIPORTS,Bears May Double Down on Bets Against Adani Group Stocks After US Bribery Charges,2024-11-21,Positive
Adani Ports and Special Economic Zone Ltd.,ADANIPORTS,Adani group cuts electricity supply to Bangladesh by half,2024-11-02,Neutral
Adani Ports and Special Economic Zone Ltd.,ADANIPORTS,Adani Enterprises Share Price: Sharp Decline as US Bribery Allegations Emerge,2024-11-21,Positive
Adani Ports and Special Economic Zone Ltd.,ADANIPORTS,Rahul Gandhi calls for Gautam Adani's immediate arrest after billionaire indicted by US,2024-11-21,Positive
Adani Ports and Special Economic Zone Ltd.,ADANIPORTS,"US Deep State FEELS THREATENED by Powerful India, Growing Military Prowess and Adani Group’s ambitious international infrastructure projects. When you can't beat them, indict them!!",2024-11-22,Negative
Adani Ports and Special Economic Zone Ltd.,ADANIPORTS,Green Energy Stocks Turn Red as Adani Probe Adds to Investors’ India Challenges,2024-11-22,Negative
Adani Ports and Special Economic Zone Ltd.,ADANIPORTS,"This is getting ridiculous. What next? Being slaves of Ambani, Adani essential for survival of Hinduism??",2024-06-22,Neutral
Adani Ports and Special Economic Zone Ltd.,ADANIPORTS,Who is Breon Peace? Understanding connection between Gautam Adani's federal prosecutor and George Soros' family,2024-11-21,Positive
Adani Ports and Special Economic Zone Ltd.,ADANIPORTS,Indian billionaire Gautam Adani charged in US over alleged $250mn bribery scheme. Prosecutors accuse tycoon and others of lying to investors and offering millions in bribes to land lucrative contracts,2024-11-21,Positive
Adani Ports and Special Economic Zone Ltd.,ADANIPORTS,Indian billionaire Adani accused of bribery,2024-11-21,Positive
Adani Ports and Special Economic Zone Ltd.,ADANIPORTS,"Adani's Business On Indian Soil Is None of America or Its Deep State's Concern, Says Arnab",2024-11-22,Negative
Apollo Hospitals Enterprise Ltd.,APOLLOHOSP,🤡🤡,2024-10-21,Neutral
Apollo Hospitals Enterprise Ltd.,APOLLOHOSP,"Pak. doctors quit Gujarat hospital. Following the arrest of a Pakistani doctor for allegedly raping a patient in the ICU of Apollo Hospital, at least a dozen Pakistani doctors have resigned.",2016-09-17,Neutral
Apollo Hospitals Enterprise Ltd.,APOLLOHOSP,"Jayalalithaa's heir case: Don't have her biological samples, Apollo Hospitals tells Madras High Court",2018-04-26,Positive
Apollo Hospitals Enterprise Ltd.,APOLLOHOSP,"Rahul Gandhi visits Apollo Hospital to check in on Jayalalita, says: ""I want to give Jayalalithaa ji maximum energy so that she gets well soon."" ROFLMFAO!",2016-10-07,Neutral
Apollo Hospitals Enterprise Ltd.,APOLLOHOSP,Tamil Nadu chief minister J Jayalalithaa (1948-2016) passes away in Chennai's Apollo Hospitals. She was 68.,2016-12-05,Neutral
Apollo Hospitals Enterprise Ltd.,APOLLOHOSP,‘Sharing details of Jayalalithaa’s treatment against ethics’ - Apollo Hospital.,2017-02-24,Neutral
Apollo Hospitals Enterprise Ltd.,APOLLOHOSP,"DCW to the aid of acid attack survivor. he action was taken after DCW received a complaint from the victim’s brother, alleging that Apollo Hospital and Army Research and Referral Hospital had refused to treat her",2015-10-01,Positive
Apollo Hospitals Enterprise Ltd.,APOLLOHOSP,"Poor patients will now get medicines at cheaper rates at Indraprastha Apollo Hospitals, announced the Delhi government on Wednesday",2015-03-19,Negative
Apollo Hospitals Enterprise Ltd.,APOLLOHOSP,When media hates a religious group,2024-10-21,Neutral
Apollo Hospitals Enterprise Ltd.,APOLLOHOSP,Hospital stocks fall for 2nd day after SC threatens to apply CGHS rates for private players,2024-03-02,Neutral
Apollo Hospitals Enterprise Ltd.,APOLLOHOSP,Hold tight!,2024-01-24,Positive
Apollo Hospitals Enterprise Ltd.,APOLLOHOSP,COVID-19 pandemic underlines need for higher budget allocation for healthcare sector,2021-01-25,Neutral
Apollo Hospitals Enterprise Ltd.,APOLLOHOSP,Chief Minister puratchi thalaivi Amma J.Jayalalitha passes away,2016-12-05,Neutral
Apollo Hospitals Enterprise Ltd.,APOLLOHOSP,Indian Financial Sector,2019-06-19,Negative
Asian Paints Ltd.,ASIANPAINT,Asian Paints Earnings Slump Sparks Quality Doubts in India,2024-11-12,Neutral
Asian Paints Ltd.,ASIANPAINT,"What’s common between Asian Paints, Crompton Anti Bacterial LED Bulb, Tropicana, Quaker Oats, Eureka Forbes Water Purifier, Kent Water Purifier, Dettol Skincare soap and Odomos? All of them have been ‘endorsed’ by the Indian Medical Association and violated the law.",2024-11-02,Neutral
Asian Paints Ltd.,ASIANPAINT,Asian Paints’ shareholders had a fear that Goldman Sachs just confirmed— Indians will not rush to do up their homes,2020-05-12,Negative
Asian Paints Ltd.,ASIANPAINT,Asian Paints blames slow car production for fall in sales⁠— and that pain is far from over,2020-06-24,Neutral
Asian Paints Ltd.,ASIANPAINT,Vijay Shekhar Sharma resigns as chairman of Paytm Payments Bank;,2024-02-27,Neutral
Asian Paints Ltd.,ASIANPAINT,"The Arrival of Demons, by Khadim Ali",2021-08-17,Positive
Asian Paints Ltd.,ASIANPAINT,Indian Financial Sector,2019-09-24,Positive
Asian Paints Ltd.,ASIANPAINT,Wikipedia Page of the Day: Bhimbetka rock shelters,2016-06-10,Neutral
Axis Bank Ltd.,AXISBANK,"FIU imposes over Rs 1.66 cr fine on Axis Bank for failing to detect fraud NSG account, ET LegalWorld",2024-06-13,Neutral
Axis Bank Ltd.,AXISBANK,"SBI, ICICI Bank, Axis Bank, PNB, AU Small Finance Bank warn customers about banking frauds; different scams, ways to safeguard yourself",2024-05-23,Positive
Axis Bank Ltd.,AXISBANK,Axis Bank may face P&L hit in Q4 on Citi India retail buyout,2023-03-03,Neutral
Axis Bank Ltd.,AXISBANK,"Kotak Mahindra | Axis Bank | HDFC Bank : After Axis and HDFC Bank, will Kotak Mahindra go the M&A way?",2022-04-06,Neutral
Axis Bank Ltd.,AXISBANK,"axis bank: Citi's India retail business: Kotak, Axis Bank lead race",2021-12-07,Neutral
Axis Bank Ltd.,AXISBANK,"kotak mahindra bank: Citi consumer business: Kotak Mahindra, Axis and IndusInd submit bids",2021-10-27,Negative
Axis Bank Ltd.,AXISBANK,"Mumbai Police will transfer salary accounts of 50,000 cops from Axis bank soon. Much needed move considering how arbitrarily the bank was chosen& state government employees’ salary accounts moved overnight.",2020-10-23,Positive
Axis Bank Ltd.,AXISBANK,More trouble for @Dev_Fadnavis. The Bombay High Court's Nagpur bench sought BJP MLA & Leader of Opposition @Dev_Fadnavis response to a petition questioning the transfer of salary accounts of the police department to Axis Bank -a private lender. @BJP4Maharashtra @BJP4India,2020-03-05,Negative
Axis Bank Ltd.,AXISBANK,"IL&FS: NCLT threatens to get Axis Bank, Standard Chartered CEOs arrested for not personally attending the hearings so far.",2019-11-25,Neutral
Axis Bank Ltd.,AXISBANK,"Devendra Fadnavis Pushed Police To Open Accounts In Axis Bank, Where Wife Is VP, Alleges Petition [NP]",2019-08-30,Neutral
Axis Bank Ltd.,AXISBANK,Axis Bank Manager uses bank data to demand sexual favours from lady customers,2016-12-16,Negative
Axis Bank Ltd.,AXISBANK,"Three directors of Mumbai firm [Parekh Alluminex Ltd.] held for defrauding Axis Bank of Rs 4,000 Cr.",2018-03-19,Neutral
Axis Bank Ltd.,AXISBANK,"Fitch downgrades credit ratings of ICICI Bank, Axis Bank to junk status. The one-notch downgrade of ICICI Bank, Fitch said, reflects its assessment of India’s operating environment",2019-06-05,Neutral
Axis Bank Ltd.,AXISBANK,Arvind Kejriwal’s AAP name props us in Axis Bank black money scam,2016-12-13,Positive
Axis Bank Ltd.,AXISBANK,It's raining money! Axis Bank ATM delivers 5 times the cash sought - Here is what happened,2018-06-20,Positive
Axis Bank Ltd.,AXISBANK,"SBI reports divergence of Rs 23,239 crore, joining likes of HDFC Bank, Axis Bank, Yes Bank. State Bank of India, the country's largest bank, reported its first quarterly loss in 17 years, shocking analysts who were busy predicting profits of over Rs 2,000 crore.",2018-02-14,Negative
Axis Bank Ltd.,AXISBANK,"Suspicious deals: Axis Bank suspends 24 employees, 50 accounts",2016-12-16,Negative
Axis Bank Ltd.,AXISBANK,Over Rs 100 crore found in 44 suspect accounts in raids on Delhi's Axis Bank branch.,2016-12-09,Positive
Axis Bank Ltd.,AXISBANK,"HDFC, ICICI, Axis banks will now charge you Rs 150 after 4 free transactions a month",2017-03-01,Positive
Axis Bank Ltd.,AXISBANK,IT raid at Axis Bank in Noida: Over Rs 60 crore deposited in accounts of 20 fake companies,2016-12-15,Negative
Axis Bank Ltd.,AXISBANK,"3.2 million debit cards compromised; SBI, HDFC Bank, ICICI, YES Bank and Axis worst hit - The Economic Times",2016-10-20,Neutral
Axis Bank Ltd.,AXISBANK,"JUST NOW: Axis Bank CMO, Manisha Lath Gupta to join AAP [OLD]",2016-12-16,Negative
Axis Bank Ltd.,AXISBANK,"Axis Bank, Punjab National Bank, others cut fixed deposit rates as demonetisation cash pours in",2016-11-23,Neutral
Axis Bank Ltd.,AXISBANK,India picks banks to sell $925 mln Axis Bank stake: Sources,2014-01-21,Positive
Axis Bank Ltd.,AXISBANK,5 midcaps that can give up to 30% | Govt to sell $925mn Axis Bank stake,2014-01-21,Positive
Bajaj Auto Ltd.,BAJAJ-AUTO,"Bajaj Auto to launch CNG-run motorcycle in June 2024, says no plans to make cars or enter racing",2024-03-25,Neutral
Bajaj Auto Ltd.,BAJAJ-AUTO,"In terms of market cap, India’s Bajaj Auto is the world’s largest two wheeler company.",2021-06-29,Positive
Bajaj Auto Ltd.,BAJAJ-AUTO,"Hamara Rahul Bajaj: As He Rides Into The Sunset, The Man Who Gave Us Chetak, Priya, Kawasaki And The Ubiquitous Auto, Leaves Behind A Rich Legacy",2021-04-30,Neutral
Bajaj Auto Ltd.,BAJAJ-AUTO,Maharashtra: BJP MLA asks if a fine of Rs 143 crore on Bajaj Auto was reduced to Rs 25 crore after meeting Aaditya Thackeray A fine was imposed on Bajaj Auto for not starting any work on a plot of land in Chakan allotted by MIDC in 2008,2021-03-10,Negative
Bajaj Auto Ltd.,BAJAJ-AUTO,"Fake TRP case: After Bajaj Auto, Parle to blacklist 'toxic' TV channels",2020-10-12,Neutral
Bajaj Auto Ltd.,BAJAJ-AUTO,"Runner Automobiles, a newly listed company with stock exchange, is going to set up a three wheeler manufacturing plant in Bangladesh with the association of Indian automobile giant Bajaj Auto Ltd. - This will be the first ever three wheeler manufacturing set-up of a global brand in Bangladesh.",2020-09-16,Positive
Bajaj Auto Ltd.,BAJAJ-AUTO,"CNBC-TV18 Exclusive | Bajaj Auto sees highest ever retail sales of all business in history of the company, says Rakesh Sharma, ED, @bajaj_ltd . Also tells @_soniashenoy @latha_venkatesh that inventory is at the lowest level in 18 months",2019-11-01,Positive
Bajaj Auto Ltd.,BAJAJ-AUTO,"Bajaj Auto: No investment, no demand, will growth fall from heavens, Rahul Bajaj asks govt",2019-07-29,Positive
Bajaj Auto Ltd.,BAJAJ-AUTO,This week in Auto: Electric bike prices finally match petrol counterparts; Bajaj’s Chetak to be base for KTM,2019-11-16,Neutral
Bajaj Auto Ltd.,BAJAJ-AUTO,Auto crisis more due to overproduction than slowdown in economy: Rajiv Bajaj,2019-09-11,Neutral
Bajaj Auto Ltd.,BAJAJ-AUTO,"Home-grown two-wheeler maker, Bajaj Auto is planning to bring in Electric vehicle in the financial year 2019-2020. As per a senior company official, the development will take place across segments.",2019-06-03,Neutral
Bajaj Auto Ltd.,BAJAJ-AUTO,"Bajaj Auto to offer 5 years insurance, 5 free services and 5 years of warranty on select motorcycles",2018-10-05,Negative
Bajaj Auto Ltd.,BAJAJ-AUTO,"BS-III vehicle ban: 2-wheeler majors Hero, Honda, Bajaj Auto, Suzuki offer discounts up to Rs 22,000",2017-03-31,Neutral
Bajaj Auto Ltd.,BAJAJ-AUTO,Bajaj Auto Ltd motorcycle sales down 13 per cent in December,2014-01-03,Neutral
Bajaj Auto Ltd.,BAJAJ-AUTO,Bajaj Auto motorcycle sales down 13% in December,2014-01-03,Neutral
Bajaj Auto Ltd.,BAJAJ-AUTO,"Slogans aren't enough, we need real skilling, says Rajiv Bajaj",2024-03-24,Neutral
Bajaj Auto Ltd.,BAJAJ-AUTO,RBI bars JM Financial from financing against shares & debentures on serious deficiencies,2024-03-06,Negative
Bajaj Auto Ltd.,BAJAJ-AUTO,"Before 2040, Reliance Industries' market capitalization is probably going to reach $1 trillion.",2024-02-17,Neutral
Bajaj Auto Ltd.,BAJAJ-AUTO,"Autos to electronic goods and home appliances, industry looking at an awful April",2021-04-15,Negative
Bajaj Auto Ltd.,BAJAJ-AUTO,What Raj Thackeray really said..,2016-03-10,Neutral
Bajaj Auto Ltd.,BAJAJ-AUTO,Indian Financial Sector Daily Update,2019-04-06,Neutral
Bajaj Finance Ltd.,BAJFINANCE,Bajaj Housing Finance issue opens today; GMP signals 73% upside,2024-09-09,Positive
Bajaj Finance Ltd.,BAJFINANCE,"Slogans aren't enough, we need real skilling, says Rajiv Bajaj",2024-03-24,Neutral
Bajaj Finance Ltd.,BAJFINANCE,"Bajaj Auto to launch CNG-run motorcycle in June 2024, says no plans to make cars or enter racing",2024-03-25,Neutral
Bajaj Finance Ltd.,BAJFINANCE,Reviving Nostalgia: Bajaj Chetak’s Electric Renaissance,2023-12-23,Neutral
Bajaj Finance Ltd.,BAJFINANCE,Bajaj sugar mills owe crores of rupees to sugarcane farmers. Is this why Rahul Bajaj ‘afraid’? - Opindia News,2019-12-04,Neutral
Bajaj Finance Ltd.,BAJFINANCE,"After Tahir Hussain, now Jahangirpuri Hanuman Jayanti attack mastermind Ansar Sheikh turns out to be AAP worker. Till 2020, he used to campaign for BJP leader Sangeeta Bajaj. Ansar was also involved for mobilising women for Shaheen Bagh protests",2022-04-24,Neutral
Bajaj Finance Ltd.,BAJFINANCE,Revenue secretary Tarun Bajaj reveals the reason why govt has not offered tax relief to individuals,2022-02-03,Negative
Bajaj Finance Ltd.,BAJFINANCE,"In terms of market cap, India’s Bajaj Auto is the world’s largest two wheeler company.",2021-06-29,Neutral
Bajaj Finance Ltd.,BAJFINANCE,"[Saswati Sarkar] Bajaj has withdrawn business from TV channels whose style he does not like. Both that and attack on Tanishq are examples of “cancel culture”, boycotting because of views. But, note how only one is being equated to a terrorist attack, but the other is being celebrated.",2020-10-14,Neutral
Bajaj Finance Ltd.,BAJFINANCE,"Hamara Rahul Bajaj: As He Rides Into The Sunset, The Man Who Gave Us Chetak, Priya, Kawasaki And The Ubiquitous Auto, Leaves Behind A Rich Legacy",2021-04-30,Positive
Bajaj Finance Ltd.,BAJFINANCE,"In 2020,TATA ,Godrej, Bajaj,Birla, Airtel,Ambani,DCM Shriram,Kiran Shaw,etc joined along with Lockheed Martin as trustees of strategy thinktank CSEP,erstwhile India centre of US thinktank Brookings.Brookings has frmr CIA officials as senior fellows & regularly hold public talks with CIA officials",2021-08-22,Neutral
Bajaj Finance Ltd.,BAJFINANCE,"India Likely To Have Achieved Covid Herd Immunity As We Are A Country Of Ignorant, Illiterate And In-Disciplined People: NDTV's Favorite Indutrialist Rajiv Bajaj",2021-02-05,Negative
Bajaj Finance Ltd.,BAJFINANCE,"Old Bajaj Chetak spotted in Antalya, Turkey!",2018-10-17,Negative
Bajaj Finance Ltd.,BAJFINANCE,Are bureaucrats taking advantage of PMs total engrossment with Coronavirus Pandemic ? Today Tarun Bajaj has been made Secy Economic Affairs MoF. He as Textile Secy 2017 gave a contract to NDTV. PM intervened and cancelled it. As Haryana cadre he was Vadra chela. PM must intervene,2020-04-27,Positive
Bajaj Finance Ltd.,BAJFINANCE,Maharashtra: BJP MLA asks if a fine of Rs 143 crore on Bajaj Auto was reduced to Rs 25 crore after meeting Aaditya Thackeray A fine was imposed on Bajaj Auto for not starting any work on a plot of land in Chakan allotted by MIDC in 2008,2021-03-10,Negative
Bajaj Finance Ltd.,BAJFINANCE,"Fake TRP case: After Bajaj Auto, Parle to blacklist 'toxic' TV channels",2020-10-12,Positive
Bajaj Finance Ltd.,BAJFINANCE,"Why kill ICE bikes in the electric rush, ask Bajaj and TVS",2019-06-24,Positive
Bajaj Finance Ltd.,BAJFINANCE,"Punjabi college students make a Maruti 800-engine powered motorcycle using Bajaj Pulsar, Royal Enfield parts",2020-08-23,Neutral
Bajaj Finance Ltd.,BAJFINANCE,"Amit Shah to Rahul Bajaj: ‘If you say there’s an atmosphere, we’ll work to improve it’ - Times of India",2019-12-02,Neutral
Bajaj Finance Ltd.,BAJFINANCE,"It is a measure of our times that a speech by industrialist Rahul Bajaj, expressing fear and concern about the government’s unwillingness to take criticism, should be hailed as a heroic gesture.",2019-12-03,Neutral
Bajaj Finance Ltd.,BAJFINANCE,"Runner Automobiles, a newly listed company with stock exchange, is going to set up a three wheeler manufacturing plant in Bangladesh with the association of Indian automobile giant Bajaj Auto Ltd. - This will be the first ever three wheeler manufacturing set-up of a global brand in Bangladesh.",2020-09-16,Neutral
Bajaj Finance Ltd.,BAJFINANCE,Rahul's interactions on COVID-19: Congress releases teaser of discussion with industrialist Rajiv Bajaj,2020-06-04,Positive
Bajaj Finance Ltd.,BAJFINANCE,Cases soar; Bajaj calls lockdown ‘draconian’ (in video conversation with Rahul Gandhi),2020-06-05,Negative
Bajaj Finance Ltd.,BAJFINANCE,Bajaj Chetak electric scooter to launch on 14 January: Bookings to open soon,2020-01-08,Neutral
Bajaj Finance Ltd.,BAJFINANCE,"Amit Shah listening, Rahul Bajaj speaks: No one will tell you; not sure you like criticism",2019-12-01,Neutral
Bajaj Finserv Ltd.,BAJAJFINSV,Bajaj Housing Finance issue opens today; GMP signals 73% upside,2024-09-09,Neutral
Bajaj Finserv Ltd.,BAJAJFINSV,"Slogans aren't enough, we need real skilling, says Rajiv Bajaj",2024-03-24,Neutral
Bajaj Finserv Ltd.,BAJAJFINSV,"Bajaj Auto to launch CNG-run motorcycle in June 2024, says no plans to make cars or enter racing",2024-03-25,Neutral
Bajaj Finserv Ltd.,BAJAJFINSV,Reviving Nostalgia: Bajaj Chetak’s Electric Renaissance,2023-12-23,Neutral
Bajaj Finserv Ltd.,BAJAJFINSV,Bajaj sugar mills owe crores of rupees to sugarcane farmers. Is this why Rahul Bajaj ‘afraid’? - Opindia News,2019-12-04,Negative
Bajaj Finserv Ltd.,BAJAJFINSV,"After Tahir Hussain, now Jahangirpuri Hanuman Jayanti attack mastermind Ansar Sheikh turns out to be AAP worker. Till 2020, he used to campaign for BJP leader Sangeeta Bajaj. Ansar was also involved for mobilising women for Shaheen Bagh protests",2022-04-24,Neutral
