Company Name,Symbol,Headline,Publish Date,Sentiment
Bajaj Finserv Ltd.,BAJAJFINSV,Revenue secretary Tarun Bajaj reveals the reason why govt has not offered tax relief to individuals,2022-02-03,Negative
Bajaj Finserv Ltd.,BAJAJFINSV,"In terms of market cap, India’s Bajaj Auto is the world’s largest two wheeler company.",2021-06-29,Negative
Bajaj Finserv Ltd.,BAJAJFINSV,"[Saswati Sarkar] Bajaj has withdrawn business from TV channels whose style he does not like. Both that and attack on Tanishq are examples of “cancel culture”, boycotting because of views. But, note how only one is being equated to a terrorist attack, but the other is being celebrated.",2020-10-14,Neutral
Bajaj Finserv Ltd.,BAJAJFINSV,"Hamara Rahul Bajaj: As He Rides Into The Sunset, The Man Who Gave Us Chetak, Priya, Kawasaki And The Ubiquitous Auto, Leaves Behind A Rich Legacy",2021-04-30,Neutral
Bajaj Finserv Ltd.,BAJAJFINSV,"In 2020,TATA ,Godrej, Bajaj,Birla, Airtel,Ambani,DCM Shriram,Kiran Shaw,etc joined along with Lockheed Martin as trustees of strategy thinktank CSEP,erstwhile India centre of US thinktank Brookings.Brookings has frmr CIA officials as senior fellows & regularly hold public talks with CIA officials",2021-08-22,Neutral
Bajaj Finserv Ltd.,BAJAJFINSV,"India Likely To Have Achieved Covid Herd Immunity As We Are A Country Of Ignorant, Illiterate And In-Disciplined People: NDTV's Favorite Indutrialist Rajiv Bajaj",2021-02-05,Neutral
Bajaj Finserv Ltd.,BAJAJFINSV,"Old Bajaj Chetak spotted in Antalya, Turkey!",2018-10-17,Negative
Bajaj Finserv Ltd.,BAJAJFINSV,Are bureaucrats taking advantage of PMs total engrossment with Coronavirus Pandemic ? Today Tarun Bajaj has been made Secy Economic Affairs MoF. He as Textile Secy 2017 gave a contract to NDTV. PM intervened and cancelled it. As Haryana cadre he was Vadra chela. PM must intervene,2020-04-27,Positive
Bajaj Finserv Ltd.,BAJAJFINSV,Maharashtra: BJP MLA asks if a fine of Rs 143 crore on Bajaj Auto was reduced to Rs 25 crore after meeting Aaditya Thackeray A fine was imposed on Bajaj Auto for not starting any work on a plot of land in Chakan allotted by MIDC in 2008,2021-03-10,Negative
Bajaj Finserv Ltd.,BAJAJFINSV,"Fake TRP case: After Bajaj Auto, Parle to blacklist 'toxic' TV channels",2020-10-12,Positive
Bajaj Finserv Ltd.,BAJAJFINSV,"Why kill ICE bikes in the electric rush, ask Bajaj and TVS",2019-06-24,Neutral
Bajaj Finserv Ltd.,BAJAJFINSV,"Punjabi college students make a Maruti 800-engine powered motorcycle using Bajaj Pulsar, Royal Enfield parts",2020-08-23,Neutral
Bajaj Finserv Ltd.,BAJAJFINSV,"Amit Shah to Rahul Bajaj: ‘If you say there’s an atmosphere, we’ll work to improve it’ - Times of India",2019-12-02,Neutral
Bajaj Finserv Ltd.,BAJAJFINSV,"It is a measure of our times that a speech by industrialist Rahul Bajaj, expressing fear and concern about the government’s unwillingness to take criticism, should be hailed as a heroic gesture.",2019-12-03,Neutral
Bajaj Finserv Ltd.,BAJAJFINSV,"Runner Automobiles, a newly listed company with stock exchange, is going to set up a three wheeler manufacturing plant in Bangladesh with the association of Indian automobile giant Bajaj Auto Ltd. - This will be the first ever three wheeler manufacturing set-up of a global brand in Bangladesh.",2020-09-16,Negative
Bajaj Finserv Ltd.,BAJAJFINSV,Rahul's interactions on COVID-19: Congress releases teaser of discussion with industrialist Rajiv Bajaj,2020-06-04,Positive
Bajaj Finserv Ltd.,BAJAJFINSV,Cases soar; Bajaj calls lockdown ‘draconian’ (in video conversation with Rahul Gandhi),2020-06-05,Negative
Bajaj Finserv Ltd.,BAJAJFINSV,Bajaj Chetak electric scooter to launch on 14 January: Bookings to open soon,2020-01-08,Neutral
Bajaj Finserv Ltd.,BAJAJFINSV,"Amit Shah listening, Rahul Bajaj speaks: No one will tell you; not sure you like criticism",2019-12-01,Neutral
Bharat Electronics Ltd.,BEL,Bharat Electronics To Make High-Tech Helmet-Mounted Displays For Indian Military Pilots With Israeli Help,2019-03-07,Negative
Bharat Electronics Ltd.,BEL,Writing here coz the r/India and r/unitedstatesofIndia couldn't digest the progress under the NaMo government and come back with something concrete,2024-02-12,Negative
Bharat Electronics Ltd.,BEL,RIL becomes the first Indian business to reach ₹20 trillion in market capitalization.,2024-02-14,Negative
Bharat Electronics Ltd.,BEL,"Indian Arms Maker with US, EU Investors Supplies Myanmar Junta, Rights Group Says.",2022-09-20,Negative
Bharat Electronics Ltd.,BEL,Indian Financial Sector,2019-09-13,Negative
Bharat Electronics Ltd.,BEL,Vision for the Decade: Budget 2019-2020,2019-07-06,Neutral
Bharat Petroleum Corporation Ltd.,BPCL,India stalls privatisation of state-owned Bharat Petroleum as bidders exit,2022-05-22,Neutral
Bharat Petroleum Corporation Ltd.,BPCL,"Air India, Bharat Petroleum Corporation to be sold by March: FM Nirmala Sitharaman",2019-11-17,Neutral
Bharat Petroleum Corporation Ltd.,BPCL,Strategic sale of Bharat Petroleum postponed,2020-04-01,Positive
Bharat Petroleum Corporation Ltd.,BPCL,"TIL that after PM Narendra Modi asked people to give up their Gas cylinder subsidy willingly, 3,26,920 consumers of Hindustan Petroleum ,Indane,Bharat Gas combined have surrendered their subsidy.",2015-04-10,Negative
Bharat Petroleum Corporation Ltd.,BPCL,"Aramco will stay committed to Ratnagiri project. Aramco, along with its West Asia counterpart, Adnoc (Abu Dhabi National Oil Company), will jointly hold 50 per cent in the Ratnagiri refinery where the other stakeholders are IndianOil, Bharat Petroleum Corporation and Hindustan Petroleum Corporation.",2019-04-18,Negative
Bharat Petroleum Corporation Ltd.,BPCL,"Indian Olympic Team Uniform, Thoughts?",2024-07-16,Negative
Bharat Petroleum Corporation Ltd.,BPCL,lThe BJP's 2019 campaign platform is already taking root and is driven by broad based grassroots level support,2017-10-19,Neutral
Bharat Petroleum Corporation Ltd.,BPCL,Indian Financial Sector,2019-10-16,Positive
Bharat Petroleum Corporation Ltd.,BPCL,Indian Financial Sector,2019-11-17,Neutral
Bharat Petroleum Corporation Ltd.,BPCL,The dillemna of crackers in India,2016-10-30,Neutral
Bharat Petroleum Corporation Ltd.,BPCL,Indian Financial Sector,2019-10-20,Neutral
Bharat Petroleum Corporation Ltd.,BPCL,Indian Financial Sector,2019-09-23,Neutral
Bharat Petroleum Corporation Ltd.,BPCL,Indiab Financial Sector,2019-08-10,Neutral
Bharat Petroleum Corporation Ltd.,BPCL,Indian Financial Sector,2019-05-26,Neutral
Bharti Airtel Ltd.,BHARTIARTL,"Secular wishes by 
airtel",2024-10-27,Neutral
Bharti Airtel Ltd.,BHARTIARTL,Vote for congress,2024-04-30,Negative
Bharti Airtel Ltd.,BHARTIARTL,"375 million Airtel India customers details including phone, email, address, parents name, gov ID (Aadhaar,etc.) updated to June 2024.",2024-07-05,Neutral
Bharti Airtel Ltd.,BHARTIARTL,Musk vs. Ambani: Telecom Minister says no to satellite spectrum allocation pitch by Jio and Airtel,2024-10-18,Neutral
Bharti Airtel Ltd.,BHARTIARTL,Bharti Airtel partners with Sony for India’s first anime channel,2024-02-25,Neutral
Bharti Airtel Ltd.,BHARTIARTL,"Airtel AirFibre Unlimited 5G Data, Jio Airfibre lauch date 28 August?",2023-08-23,Neutral
Bharti Airtel Ltd.,BHARTIARTL,[Minhaz Merchant] Huawei effectively shut out of 4G & 5G in India following new government rules to restrict procurement of telecom equipment only from “trusted” vendors — which Huawei is not.⁦⁩ Airtel⁩ ⁦must comply. Kudos to Gaurav Sawant ⁩ for exposing security risk,2021-03-15,Negative
Bharti Airtel Ltd.,BHARTIARTL,Airtel’s Gopal Vittal earned more than chairman Sunil Mittal in FY23: Annual report,2023-08-12,Neutral
Bharti Airtel Ltd.,BHARTIARTL,"Jio and Airtel add 3,500 5G sites per week in ramp up",2022-11-07,Neutral
Bharti Airtel Ltd.,BHARTIARTL,"Airtel Digital TV, Tata Play, Dish TV and Sun Direct's accounting under CAG scrutiny",2022-10-26,Neutral
Bharti Airtel Ltd.,BHARTIARTL,"Airtel Digital TV users can cut down their monthly DTH bill, here is how",2022-09-20,Neutral
Bharti Airtel Ltd.,BHARTIARTL,Bharti Telecom acquires 3.33% Airtel stake from Singtel in $1.61 billion deal,2022-08-25,Negative
Bharti Airtel Ltd.,BHARTIARTL,"Reliance Jio hikes tariffs only days after Bharti Airtel, Vodafone Idea",2021-11-29,Neutral
Bharti Airtel Ltd.,BHARTIARTL,Mittal Family | Airtel: Mittal family's plan to buy Airtel stake from Singtel hits valuation bump,2022-07-07,Negative
Bharti Airtel Ltd.,BHARTIARTL,"Six players in field for IPL media rights; Google, Amazon, Airtel missing from action",2022-06-11,Neutral
Bharti Airtel Ltd.,BHARTIARTL,"Telcos: TCS vs telcos? Jio, Airtel flag concerns over 5G for private networks",2022-06-09,Neutral
Bharti Airtel Ltd.,BHARTIARTL,Bharti Airtel: Singtel set to dial Sunil Mittal to sell part stake in Bharti Airtel,2022-05-26,Positive
Bharti Airtel Ltd.,BHARTIARTL,"Made In India: Airtel DTH Arm To Stop Import Of Set Top Box By December End, Starts Local Production In UP's Noida",2021-09-28,Neutral
Bharti Airtel Ltd.,BHARTIARTL,"Phone bills to rise 25% as Airtel, Vi eye tariff hikes; Jio mum",2022-02-11,Positive
Bharti Airtel Ltd.,BHARTIARTL,Huawei bags Rs 300 crore network contract from Bharti Airtel,2021-03-07,Neutral
Bharti Airtel Ltd.,BHARTIARTL,"Blocking websites is secret in India, now researchers are probing Airtel and ACT networks to reveal details",2021-12-09,Negative
Bharti Airtel Ltd.,BHARTIARTL,"After Investing Rs 34000 Crore In Jio,Google To Make Large Investment In Airtel.G buying up our comm infra for censoring or worse.US NSA considers G key member of US Military Base,Google chief called it Lockheed Martin of 21st century.Assagne wrote a whole book on G working as US neocolonialist arm",2021-08-28,Neutral
Bharti Airtel Ltd.,BHARTIARTL,"Porn sites banned in India: After Jio, Airtel, Vodafone, Idea and BSNL to block porn websites in India",2018-10-28,Neutral
Bharti Airtel Ltd.,BHARTIARTL,Bharati Airtel and Capgemini have teamed up to offer Indian businesses 5G-based solutions.,2021-12-15,Negative
Bharti Airtel Ltd.,BHARTIARTL,"DoT Has Reached Out To Bharti Airtel, Vodafone Idea And Jio Regarding Telecom Relief Package",2021-10-19,Negative
Britannia Industries Ltd.,BRITANNIA,"Charter of the Halal org funded by all Halal certified products-from Nestle Horlicks & Boost to Britannia biscuits to Patanjali & Amul states they will use funds to defend Muslim terror-accused.And true to charter,they fund for legal defense of LeT terrorists,Mujahideen blastcase,ISI cases-long list",2022-04-02,Neutral
Britannia Industries Ltd.,BRITANNIA,Consumers thinking twice before buying a Rs 5 pack: Britannia,2019-08-13,Neutral
Britannia Industries Ltd.,BRITANNIA,[Zoke Tyme] Britannia hires their own secular Baba Ramdev look alike against growing competition from Patanjali,2016-03-01,Neutral
Britannia Industries Ltd.,BRITANNIA,"60th Britannia Filmfare Awards 2014: Queen rules with 6, Haider hits high 5",2015-02-01,Neutral
Britannia Industries Ltd.,BRITANNIA,Indian Stock Market today: 4th May,2023-05-04,Neutral
Britannia Industries Ltd.,BRITANNIA,Indians unable to buy Rs 5 biscuits shows how badly wages are suppressed,2019-08-25,Neutral
Cipla Ltd.,CIPLA,Torrent Pharma looks to tie up with CVC Capital to fund Cipla purchase,2023-09-18,Negative
Cipla Ltd.,CIPLA,Bain dials Dr Reddy's Laboratories to team up for joint Cipla bid,2023-09-05,Neutral
Cipla Ltd.,CIPLA,Blackstone sets its sights on buying out Hamieds from Cipla,2023-08-04,Positive
Cipla Ltd.,CIPLA,Cipla’s Covid-19 Testing Kit ‘ViraGen’ Will Hit The Market Today,2021-05-25,Neutral
Cipla Ltd.,CIPLA,Cipla Seeks Centre’s Support Ahead Of Committing Over $1 Billion For Moderna’s Covid-19 Booster Vaccine,2021-06-02,Neutral
Cipla Ltd.,CIPLA,Cipla receives regulatory approval for launch of Ciplenza (Favipiravir 200 mg) in India priced at Rs 68 per tablet,2020-07-25,Neutral
Cipla Ltd.,CIPLA,"India's fourth-largest drugmaker, Cipla Pharma To Buy two US Firms For $550 Million",2015-09-04,Neutral
Coal India Ltd.,COALINDIA,India's thermal coal imports rise nominal 6% in Jan-Oct'24. What lies ahead?,2024-11-21,Neutral
Coal India Ltd.,COALINDIA,"Coal, iron ore to dominate bulk shipping over 5 years; India seen driving freight market",2024-09-24,Neutral
Coal India Ltd.,COALINDIA,"7th Indian Iron Ore & Pellet Summit
6th Indian DRI, Scrap & Steel Conference
4th India Coal Outlook Conference in Gurugram kicked off by https://www.bigmint.co 600+ Industry expert around the world attended the conference!",2024-08-22,Neutral
Coal India Ltd.,COALINDIA,"India holds firm on coal use, faces backlash from west.",2021-11-14,Neutral
Coal India Ltd.,COALINDIA,"‘It was a set-up, we were fooled’: the coal mine that ate an Indian village | In a pristine forest in central India, the multibillion-dollar mining giant Adani has razed trees – and homes – to dig more coal. How does this kind of destruction get the go-ahead?",2022-12-22,Positive
Coal India Ltd.,COALINDIA,"India can replace coal imports but only with improved domestic supplies, railway logistics",2022-12-21,Negative
Coal India Ltd.,COALINDIA,"India taps oil, natural gas, coking coal in Russian Arctic region",2022-12-17,Neutral
Coal India Ltd.,COALINDIA,Why this corporate misadventure in Australia should make Indians angry - India's biggest private bank bets $1.1 billion on a failed Aussie coal mine while poverty reigns at home,2022-11-19,Neutral
Coal India Ltd.,COALINDIA,Coal mining is experiencing a continued decline in India,2021-02-19,Neutral
Coal India Ltd.,COALINDIA,coal india: Adani Enterprises lowest bidder in CIL import tender,2022-07-04,Neutral
Coal India Ltd.,COALINDIA,power plants: India to let power plants blend up to 30% imported coal to avoid a grid collapse,2022-05-20,Negative
Coal India Ltd.,COALINDIA,"Coal shortage, heatwave and dry spell spark power crisis | India News - Times of India",2022-04-30,Neutral
Coal India Ltd.,COALINDIA,"India: Free Trade Pact With Australia (AI-ECTA, inked last week) Could Address India's Energy Requirements. 'tariffs on items such as coal, alumina, metallic ores, liquified natural gas (LNG) and other crucial minerals - which Australia exports - will be immediately reduced to zero.'",2022-04-09,Neutral
Coal India Ltd.,COALINDIA,"Brutal temperatures scorch parts of India, where shortages of coal are causing daily power outages",2022-05-03,Neutral
Coal India Ltd.,COALINDIA,Power crisis: 240 passenger trains cancelled in India to make way for 400 coal rakes,2022-04-29,Neutral
Coal India Ltd.,COALINDIA,Are India And China Taking Divergent Views On Coal Usage? What does it mean for India's energy security when even European nations aren't able to rely on renewables?,2022-03-28,Negative
Coal India Ltd.,COALINDIA,EXCLUSIVE India's State Coal Giant Plans Bulk Exports For First Time,2022-02-04,Neutral
Coal India Ltd.,COALINDIA,India has top three largest and five of ten largest Solar Farms in the world. Solar energy is now cheaper than Coal. India produces cheapest Solar Cells in the world. Below is the latest inaugrated.,2020-12-17,Negative
Coal India Ltd.,COALINDIA,Guys keep the trapped Meghalaya miners in your thoughts.Their fight against death is not getting the due attention. After 15 days Coal India received state govt's request for help sent on 20th Dec. They are doing communication via letters? Shocking,2018-12-27,Neutral
Coal India Ltd.,COALINDIA,Coal India Gives Rs 16 Crore to Employee to Treat Daughters Spinal Muscular Atrophy,2021-11-22,Positive
Coal India Ltd.,COALINDIA,"coal india: Stable coal supplies to power units, cooler weather and long weekend ease crisis",2021-10-16,Neutral
Coal India Ltd.,COALINDIA,क्या चाहते हैं कोयला खदानों के पास रहने वाले [The true costs of coal mining in India],2021-08-12,Negative
Coal India Ltd.,COALINDIA,SBI: Biggest bank in India torn between BlackRock and funding coal,2021-06-03,Positive
Coal India Ltd.,COALINDIA,"[AVirmani]FCI & CoalIndia were the 2 most corrupt PSUs when I kept track.PSBs have to give workingcap loans to FCI against stocks.When I was Director of a large PSB,auditor refused to certify FCI stocks ie they existed only on paper/had rotted.Wheat/rice stocks are 3x the required amt causing losses",2020-12-06,Neutral
Coal India Ltd.,COALINDIA,Chhattisgarh Minister has threatened to stop coal supply to power plants all over India. (This time Congress has come up with AAP level troll Ministers in Chhattisgarh),2019-11-09,Neutral
Dr. Reddy's Laboratories Ltd.,DRREDDY,Dr Reddy’s denies Congress’ claim of conflict in payments to SEBI chief Madhabi Buch’s husband Dhaval | Mint,2024-09-11,Neutral
Dr. Reddy's Laboratories Ltd.,DRREDDY,Bain dials Dr Reddy's Laboratories to team up for joint Cipla bid,2023-09-05,Neutral
Dr. Reddy's Laboratories Ltd.,DRREDDY,EP-43|‘Modi’s Missile Man’ Ft Dr G Satheesh Reddy(Fmr DRDO Chief & curre...,2023-02-28,Positive
Dr. Reddy's Laboratories Ltd.,DRREDDY,EP-43|‘Modi’s Missile Man’ Ft Dr G Satheesh Reddy(Fmr DRDO Chief & curre...,2023-02-28,Positive
Dr. Reddy's Laboratories Ltd.,DRREDDY,Dr. Reddy is named among a group of companies around the world that conspired to artificially inflate the price of cancer drug after the patent expired.,2022-11-23,Neutral
Dr. Reddy's Laboratories Ltd.,DRREDDY,Dr Reddy's denied approval for Phase 3 trials of Sputnik Light Covid vaccine,2021-07-01,Neutral
Dr. Reddy's Laboratories Ltd.,DRREDDY,"Sputnik V Vaccine's India Maker Dr Reddy's Clarifies Day After Announcing Price of Around ₹ 750; Imports to start in May but exact date unclear, quantity in ""several hundred thousand""",2021-04-22,Neutral
Dr. Reddy's Laboratories Ltd.,DRREDDY,"How To Check Remdesivir Availability Anywhere In India - To help people get access to the drug easily, pharma major Dr Reddy's Laboratories' official website has listed various details on the availability of Remdesivir as well as Favipiravir tablets used to treat Covid patients.",2021-04-16,Positive
Dr. Reddy's Laboratories Ltd.,DRREDDY,A Photo frame of Dr Priyanka Reddy was placed in Varanasi's Ganga Aarti to pray for her Moksh. Shame on those who labeled Hindus as rapists. Varanasi praying for India's daughter stands as a testimony to our faith in the divinity of the feminine. Pranams🙏,2019-12-02,Neutral
Dr. Reddy's Laboratories Ltd.,DRREDDY,"No need to panic, COVID-19 is something we can easily conquer: Padma Bhushan Dr D Nageshwar Reddy",2020-03-29,Neutral
Dr. Reddy's Laboratories Ltd.,DRREDDY,"COVID-19 crisis: Need social distancing for one year, says PHFI’s Dr K Srinath Reddy",2020-04-22,Neutral
Dr. Reddy's Laboratories Ltd.,DRREDDY,"Focus on API industry, cutting imports needs of the hour, says Satish Reddy - chairman Dr Reddy’s Labs; ""Indian pharma is the world’s 3rd largest by volume; over 60% of global demand for vaccines, anti-retro viral drugs, 30% of #UNICEF’s annual supply and 60%-80% UN’s purchases of drugs.""",2020-01-09,Neutral
Dr. Reddy's Laboratories Ltd.,DRREDDY,"Jagan Reddy Renames Dr APJ Abdul Kalam Award After His Father YSR Reddy, Cancels Order After Outrage",2019-11-05,Neutral
Dr. Reddy's Laboratories Ltd.,DRREDDY,"US pharma: Indian execs 'named' in US pharma case. The Indian generic makers named in the lawsuit are Aurobindo, Dr Reddy’s, Emcure, Glenmark, and Zydus.",2019-04-11,Neutral
Dr. Reddy's Laboratories Ltd.,DRREDDY,"Lt Col Purohit claims he was tortured to name Yogi Adityanath & RSS, VHP leaders - India Today",2024-07-24,Neutral
Dr. Reddy's Laboratories Ltd.,DRREDDY,UNVERIFIED: Resources for obtaining Remdesivir and Oxygen in major locations,2021-04-16,Positive
Dr. Reddy's Laboratories Ltd.,DRREDDY,DRDO: DCGI has granted permission for emergency use of therapeutic application of drug 2-deoxy-D-glucose (2-DG) as adjunct therapy in moderate to severe COVID-19 patients.,2021-05-08,Neutral
Dr. Reddy's Laboratories Ltd.,DRREDDY,"Weekly News round-up : February 17 - 23, 2014",2014-02-23,Neutral
Eicher Motors Ltd.,EICHERMOT,"Royal Enfield maker in the hunt for a magic bullet. A slump in Royal Enfield sales growth, increasing brand fatigue and competition from Jawa motorcycles and others are seen weighing on Eicher Motors shares and, in turn, its market capitalisation.",2018-12-05,Neutral
Eicher Motors Ltd.,EICHERMOT,Eicher Motors closes in on Ducati; to make a binding bid of $1.8 billion,2017-09-07,Neutral
Grasim Industries Ltd.,GRASIM,"Electoral bonds data | 22 companies donated over ₹100 crore, BJP got the highest share",2024-03-15,Negative
Grasim Industries Ltd.,GRASIM,Indian Financial Sector Daily Update,2019-04-06,Neutral
HCL Technologies Ltd.,HCLTECH,"Arvind Kejriwal was earlier Andolanjivi now he is fake credit-jivi. He is stealing Credit from Central Govt, DRDO and HCL for installing oxygen plants in Delhi. Delhi Govt has failed to install even one Oxygen plant",2021-06-13,Neutral
HCL Technologies Ltd.,HCLTECH,HCL Founder Views About Current India Govt Policies. Do you agree with him?,2023-08-11,Neutral
HCL Technologies Ltd.,HCLTECH,HCL Group planning $300 million semicon foray: sources,2023-07-19,Negative
HCL Technologies Ltd.,HCLTECH,"Nirav Modi's HCL House price slashed, DRT orders re-auction in Feb",2023-01-21,Neutral
HCL Technologies Ltd.,HCLTECH,Fugitive diamantaire Nirav Modi's HCL House to be auctioned on September 23,2022-08-25,Negative
HCL Technologies Ltd.,HCLTECH,"Semiconductor Manufacturing | HCL, Applied Materials and others to inves...",2021-11-20,Neutral
HCL Technologies Ltd.,HCLTECH,"hcl: Hcl Asks Exiting Staffers To Return Bonus, Draws Ire",2022-01-10,Neutral
HCL Technologies Ltd.,HCLTECH,Billionaire Tech Entrepreneur And HCL Founder Shiv Nadar Advises Tamil Students To Learn Hindi,2019-06-03,Neutral
HCL Technologies Ltd.,HCLTECH,"TCS, Infosys, Wipro, HCL, Tech Mahindra, Cognizant to cut 3 million jobs by 2022: Report",2021-06-16,Negative
HCL Technologies Ltd.,HCLTECH,"Boeing's 737 Max software outsourced to Rs 620-an-hour engineers | Based on resumes posted on social media, HCL engineers helped develop and test the Max software",2019-06-29,Neutral
HCL Technologies Ltd.,HCLTECH,Billionaire Tech Entrepreneur And HCL Founder Shiv Nadar Advises Tamil Students To Learn Hindi,2019-02-08,Negative
HCL Technologies Ltd.,HCLTECH,HCL chairman Shiv Nadar asks students to learn Hindi,2019-02-04,Neutral
HCL Technologies Ltd.,HCLTECH,HCL Tech to acquire select IBM software products for $1.8 bn,2018-12-07,Positive
HCL Technologies Ltd.,HCLTECH,HCL sets up delivery centre in Texas; to create up to 500 jobs,2015-02-04,Neutral
HCL Technologies Ltd.,HCLTECH,"HCL enters healthcare business with Rs 1,000 crore",2014-02-07,Positive
HCL Technologies Ltd.,HCLTECH,"Infy, HCL Tech or TCS; which is best IT pick post Q3 nos?",2014-01-20,Neutral
HCL Technologies Ltd.,HCLTECH,"Wipro, HCL Tech, NIIT Tech hit 52-wk highs | 5 IT stocks to buy",2014-01-20,Neutral
HCL Technologies Ltd.,HCLTECH,"Wipro, HCL Tech, NIIT hit 52-week highs | 5 IT stocks to buy",2014-01-20,Neutral
HCL Technologies Ltd.,HCLTECH,"HCL Tech posts record Q3 profits, beats estimates",2014-01-16,Positive
HCL Technologies Ltd.,HCLTECH,"HCL Tech Q2 profit rises 58.4%, beats estimates | Stock up 3%",2014-01-16,Positive
HCL Technologies Ltd.,HCLTECH,"HCL Tech surprises again, beats Dec qtr estimates with Rs 1,496 cr profit",2014-01-16,Positive
HCL Technologies Ltd.,HCLTECH,HCL Technologies' Q3 earnings per share may beat estimates: StarMine,2014-01-15,Neutral
HCL Technologies Ltd.,HCLTECH,What Murthy magic? HCL Tech beats Infosys hands down,2013-12-19,Neutral
HCL Technologies Ltd.,HCLTECH,thieves took away my everything.someone help me,2022-02-03,Neutral
HCL Technologies Ltd.,HCLTECH,Indian Financial Sector,2019-09-24,Neutral
Hero MotoCorp Ltd.,HEROMOTOCO,Expect double-digit sales growth in the two-wheeler business in the upcoming fiscal year: Hero MotoCorp,2024-02-19,Negative
Hero MotoCorp Ltd.,HEROMOTOCO,Hero MotoCorp will release its first electric scooter with interchangeable batteries in March,2022-03-03,Negative
Hero MotoCorp Ltd.,HEROMOTOCO,Taiwan’s Gogoro Partners With Hero MotoCorp To Bring Its Electric Scooter And Battery Tech To India,2021-04-22,Neutral
Hero MotoCorp Ltd.,HEROMOTOCO,"Hero MotoCorp sells 10,000 units within days of resuming retail operations",2020-05-11,Positive
Hero MotoCorp Ltd.,HEROMOTOCO,Hero MotoCorp requests government for reduction of GST in a phased manner,2019-09-19,Negative
Hero MotoCorp Ltd.,HEROMOTOCO,"Hero MotoCorp starts work on new plant in Andhra Pradesh. 1.8 million units capacity, 600 acres, 2000 direct jobs, 10,000 indirect jobs.",2018-03-23,Neutral
Hero MotoCorp Ltd.,HEROMOTOCO,Hero MotoCorp: Why India's top two-wheeler makers are stepping on the gas to grab the premium slice of the motorcycle market,2017-09-01,Neutral
Hero MotoCorp Ltd.,HEROMOTOCO,Hero MotoCorp invests in electric scooter startup Ather Energy,2016-10-27,Neutral
Hero MotoCorp Ltd.,HEROMOTOCO,Hero MotoCorp acquires 60 per cent stake in JV with Magneti Marelli,2013-12-11,Negative
Hero MotoCorp Ltd.,HEROMOTOCO,Indian Stock Market today: 4th May,2023-05-04,Positive
Hero MotoCorp Ltd.,HEROMOTOCO,Indian Financial Sector,2019-09-16,Neutral
Hero MotoCorp Ltd.,HEROMOTOCO,Indian Financial Sector,2019-10-03,Neutral
Hindalco Industries Ltd.,HINDALCO,Aditya Birla's Hindalco faces fresh CBI probe,2015-03-15,Neutral
Hindalco Industries Ltd.,HINDALCO,"Government cancels SEZs of Hindalco, Essar, Adani",2014-09-29,Neutral
Hindalco Industries Ltd.,HINDALCO,21th Feb News Highlights from Stock Market,2024-02-21,Neutral
Hindalco Industries Ltd.,HINDALCO,Indian Financial Sector,2019-09-24,Positive
Hindalco Industries Ltd.,HINDALCO,Political price or personal liability?(MMS is going to Jail as hinted by TheCommie),2015-03-12,Negative
Hindustan Unilever Ltd.,HINDUNILVR,"Unilever, PepsiCo sell lower quality food in India, as per reports",2024-11-10,Neutral
