Headline,Date
Maruti Suzuki: The king of roads: Why Maruti sells one in every two cars in India,2017-07-12
"The end of an era: Maruti drives off Gurugram. In the second half of 2018, Maruti Suzuki India Ltd began thinking of life beyond Gurugram. It had become far too cumbersome to continue manufacturing cars in the middle of a city which had turned into a bustling megapolis",2018-12-25
"Hit by slowdown, Maruti Suzuki to operate only one shift at all plants",2019-08-08
"Maruti Suzuki Says Goodbye To Its Diesel Plan, Focus Is On Vehicles Powered By Alternative Fuels",2021-10-01
It’s the end of the road for the iconic Maruti Suzuki Gypsy – showrooms asked to stop bookings,2019-08-08
"Corruption, crony capitalism disappeared in one year of Modi government: RC Bhargava, Maruti Suzuki",2016-01-05
Maruti Suzuki India sells 2 lakh cars via digital channel since April 2019,2020-11-16
"A Maruti car finally has 5 star safety rating. It is not Swift, Baleno, Brezza, GV. The new Dzire is the maiden model from Maruti Suzuki to have garnered a five-star Global NCAP safety rating.",2024-11-09
First time Japan will import Maruti Suzuki cars from India: Modi.,2015-12-12
"Maruti Suzuki's new mid-term plan aims to make India an export hub, launch more EVs",2025-02-21
Maruti Suzuki: April 2023 Sales Jumped 13%,2023-05-04
Maruti job cuts: Maruti Suzuki cuts temporary workforce by 6% as sales sink,2019-08-03
Maruti Suzuki India transports over 6.7 lakh cars through Indian Railways in 6 years,2020-07-10
"Robots sweep across Maruti Suzuki’s shop floor. Maruti Suzuki has one robot for every 4 factory workers at its Manesar and Gurgaon car plants, signalling growing automation in India’s manufacturing sector",2017-05-19
"The country's largest auto-maker had launched its vehicle leasing program - Maruti Suzuki vehicle subscription plans explained, now available in Delhi NCR, Bengaluru, Pune and Hyderabad",2020-09-26
"Maruti Suzuki to recall over 60,000 units of Ciaz, Ertiga and XL6 models",2019-12-06
"Maruti Suzuki says chip shortage hit Q2 profits, while company chairman reveals when to expect its electric vehicle",2021-10-29
"Maruti Suzuki’s production hit for 2nd straight month amid chip shortage, shares slide",2021-10-04
maruti suzuki: Maruti may drive in SUVs priced up to ₹20 lakh in next three years,2021-12-02
Maruti Suzuki launches Celerio in India,2014-02-06
Delhi Gets First Automated Driving Test Centre; To Be Maintained By Maruti Suzuki India,2019-03-06
Maruti Suzuki Grand Vitara launch tomorrow: Top 5 things to know - Times of India,2022-09-25
Features of new 2022 Maruti Suzuki Alto K10 that make it better than previous model,2022-08-26
"Maruti Suzuki reports 1.9% dip in sales at 1,50,630 units in November",2019-12-01
"JSW and MG Motor India join hands, plan to launch a new car every 3-6 months",2024-03-21
Maruti Suzuki Will Raise Prices In September Due To Increase In Input Costs,2021-08-30
Exclusive: Maruti Suzuki To Bring The Jimny Mini SUV To India; Likely Rebadged as Gypsy,2019-08-20
"Maruti Suzuki Q1 preview: Profit may rise 2x YoY on strong sales, margin show",2023-07-31
Allow Delhi-NCR's Senior Citizens to Keep Their Vehicles Beyond 15 Years,2022-05-27
Indian Financial Sector,2019-07-08
Indian Financial Sector,2019-06-21
Indian Financial Sector,2019-09-12
"7 dead, over 100 hospitalized as sewage mixes with drinking water in Madhya Pradesh; inquiry exposes killer lapses by authorities",2026-01-01
"Maruti, Hyundai, Mahindra, MG, Mercedes-Benz, BMW, others to hike car prices",2024-12-07
"Sebi chief flags bubble in midcap, smallcap space",2024-03-12
The RBI prohibits Paytm Payments Bank from receiving deposits after February 29.,2024-02-01
