Headline,Date
"UltraTech: In a setback for banks, UltraTech drops plan to buy Jaypee Plant",2022-07-02
Indian Financial Sector Daily Update,2019-04-06
"Exclusive: India antitrust body raids cement giants UltraTech, LafargeHolcim units: sources",2020-12-10
"Q4 results today: What UltraTech, SBI Card, Star Health and IndiaMart numbers might look like",2023-04-28
"J-K: After abolition of toll tax in Lakhanpur, UltraTech Cement reduces its price per bag from 445rs to 380rs",2020-01-03
Breaking: NCLAT approves Ultratech Cement's resolution plan for Binani Cement,2018-11-14
