Headline,Date
Oil & Natural Gas Corporation receives Investment Bank Analyst Rating Update,2025-03-30
ONGC receives Investment Bank Analyst Rating Update,2025-03-30
"Exclusive-Indian state firms seek stake in SQM’s lithium projects in Australia, sources say",2025-03-28
India stocks higher at close of trade; Nifty 50 up 0.69%,2025-03-21
India stocks lower at close of trade; Nifty 50 down 0.49%,2025-03-10
Oil And Natural Gas Corporation Ltd receives Investment Bank Analyst Rating Update,2025-02-28
EU to boost US gas imports and renewables to cut reliance on Russian energy,2025-02-21
Germany gas storage auctions still on hold amid energy concerns,2025-02-12
India stocks lower at close of trade; Nifty 50 down 0.18%,2025-02-07
Oil And Natural Gas Corporation Ltd receives Investment Bank Analyst Rating Update,2025-02-07
