Company Name,Symbol,Headline,Publish Date,Sentiment
Adani Enterprises Ltd.,ADANIENT,Adani Group to sell stake in Adani Wilmar for $2 billion,2024-12-30,Positive
Adani Enterprises Ltd.,ADANIENT,India's Adani Group seeks to settle regulatory charge of shareholding violations ET reports,2024-12-03,Positive
Adani Enterprises Ltd.,ADANIENT,India's parliament suspended after disruptions over Adani allegations other issues,2024-12-02,Neutral
Adani Enterprises Ltd.,ADANIENT,Adani Group CFO rejects bribery allegations India says no US request yet on case,2024-11-29,Positive
Adani Enterprises Ltd.,ADANIENT,Adani wipeout hurts but won't derail foreign investor faith in India,2024-11-28,Neutral
Adani Enterprises Ltd.,ADANIENT,Airports to cooking oil the many businesses of India's Gautam Adani,2024-11-28,Neutral
Adani Enterprises Ltd.,ADANIENT,India's parliament suspended temporarily after row over allegations against Adani group,2024-11-28,Neutral
Adani Enterprises Ltd.,ADANIENT,India stocks higher at close of trade Nifty 50 up 0.35%,2024-11-27,Positive
Adani Enterprises Ltd.,ADANIENT,Modi's party distances itself from India's Adani amid opposition protests,2024-11-26,Positive
Adani Enterprises Ltd.,ADANIENT,Fitch places some Adani bonds on negative watch after US bribery charges,2024-11-25,Positive
Adani Enterprises Ltd.,ADANIENT,Adani shares rise CFO says publicly listed firms not subject to US indictment,2024-11-24,Neutral
Adani Enterprises Ltd.,ADANIENT,Adani Energy Solutions says no material impact from Kenya energy deal cancellation,2024-11-23,Neutral
Adani Enterprises Ltd.,ADANIENT,Adani Group could find funding harder after US indictment as banks review credit,2024-11-23,Neutral
Adani Enterprises Ltd.,ADANIENT,Indian opposition parties deny any wrongdoing linked to Adani bribery allegations,2024-11-22,Negative
Adani Enterprises Ltd.,ADANIENT,Global banks weigh halting fresh credit to India's Adani after US indictment say sources,2024-11-22,Negative
Adani Enterprises Ltd.,ADANIENT,What you need to know about Adani's US bribery indictment,2024-11-22,Negative
Adani Enterprises Ltd.,ADANIENT,Adani's Australian coal unit faces human rights complaint,2024-11-22,Negative
Adani Enterprises Ltd.,ADANIENT,Morning Bid Bitcoin watch party rages on as PMIs loom,2024-11-22,Negative
Adani Enterprises Ltd.,ADANIENT,Adani Group firms' shares fall for second session after US indictments,2024-11-21,Positive
Adani Enterprises Ltd.,ADANIENT,Asia stocks rise as chips cyclical gains help offset Ukraine war jitters,2024-11-21,Positive
Adani Enterprises Ltd.,ADANIENT,Kenya drops over $2.5 billion of Adani deals after US indictment,2024-11-21,Positive
Adani Enterprises Ltd.,ADANIENT,Kenya halts Adani airport deal and energy project,2024-11-21,Positive
Adani Enterprises Ltd.,ADANIENT,US indictments scythe $27 billion off value of India's Adani Group firms,2024-11-21,Positive
Adani Enterprises Ltd.,ADANIENT,Nvidia's results Adani's legal woes Starbucks - what's moving markets,2024-11-21,Positive
Adani Enterprises Ltd.,ADANIENT,Morning Bid Nvidia disappoints bitcoin nears $100K,2024-11-21,Positive
Adani Enterprises Ltd.,ADANIENT,GQG Partners' stock plunges over 20% on US bribe fraud charges against India's Adani,2024-11-20,Neutral
Adani Enterprises Ltd.,ADANIENT,Adani stocks tumble hit lower circuit on US bribery fraud charges,2024-11-20,Neutral
Adani Enterprises Ltd.,ADANIENT,Asia stocks dip as Nvidia brings little cheer India slides amid Adani scandal,2024-11-20,Neutral
Adani Enterprises Ltd.,ADANIENT,Indian billionaire Gautam Adani accused of $250 mln bribery scheme by the US,2024-11-20,Neutral
Adani Enterprises Ltd.,ADANIENT,India's Adani Group to invest $10 billion in US energy following Trump win,2024-11-13,Neutral
Adani Enterprises Ltd.,ADANIENT,Adani Enterprises receives Investment Bank Analyst Rating Update,2024-10-30,Neutral
Adani Enterprises Ltd.,ADANIENT,India stocks higher at close of trade Nifty 50 up 0.65%,2024-10-28,Positive
Adani Enterprises Ltd.,ADANIENT,Adani Group denies Hindenburg comment on frozen funds in Swiss banks,2024-09-12,Neutral
Adani Enterprises Ltd.,ADANIENT,India stocks higher at close of trade Nifty 50 up 0.14%,2024-08-28,Neutral
Adani Enterprises Ltd.,ADANIENT,Billionaire Adani's Mumbai slum revamp struggles to secure land in potential setback,2024-08-25,Neutral
Adani Enterprises Ltd.,ADANIENT,$2.4 billion wiped off Adani shares after Hindenburg allegations against regulator,2024-08-12,Negative
Adani Enterprises Ltd.,ADANIENT,Adani shares fall amid Hindenburg-SEBI row,2024-08-12,Negative
Adani Enterprises Ltd.,ADANIENT,India stocks higher at close of trade Nifty 50 up 1.35%,2024-08-07,Neutral
Adani Enterprises Ltd.,ADANIENT,India's Adani Enterprises eyes first-ever public debt issue in coming weeks sources say,2024-07-30,Positive
Adani Enterprises Ltd.,ADANIENT,India stocks higher at close of trade Nifty 50 up 0.06%,2024-07-04,Negative
Adani Enterprises Ltd.,ADANIENT,Asian stocks Nikkei outperforms China lags on weak PMI,2024-07-02,Negative
Adani Enterprises Ltd.,ADANIENT,Hindenburg denies Indian regulator's allegations on Adani short bet,2024-07-02,Negative
Adani Enterprises Ltd.,ADANIENT,India stocks lower at close of trade Nifty 50 down 0.28%,2024-06-21,Neutral
Adani Enterprises Ltd.,ADANIENT,Indian stocks volatile after BJP election shock,2024-06-05,Positive
Adani Enterprises Ltd.,ADANIENT,Adani Enterprises receives Investment Bank Analyst Rating Update,2024-04-01,Negative
Adani Enterprises Ltd.,ADANIENT,Adani Enterprises Ltd. receives Investment Bank Analyst Rating Update,2024-04-01,Negative
Adani Enterprises Ltd.,ADANIENT,Adani stocks fall 2% to 4% on report of US bribery probe,2024-03-18,Neutral
Adani Enterprises Ltd.,ADANIENT,Adani Group marketing first dollar bond since Hindenburg report- BBG,2024-03-03,Neutral
Adani Enterprises Ltd.,ADANIENT,Adani Group bonds rebound as asset managers boost investments,2024-01-24,Positive
Adani Enterprises Ltd.,ADANIENT,Sensex closes up after volatile session led by Adani and energy stocks,2023-11-28,Negative
Adani Enterprises Ltd.,ADANIENT,Indian stocks edge higher as foreign investors return Adani shares surge,2023-11-28,Negative
Adani Enterprises Ltd.,ADANIENT,Adani group stocks surge following Supreme Court guidance to Sebi,2023-11-28,Negative
Adani Enterprises Ltd.,ADANIENT,Indian exchanges fine major companies for listing noncompliance,2023-11-22,Positive
Adani Enterprises Ltd.,ADANIENT,West Bengal cancels Adani Ports deep sea port project tender,2023-11-22,Positive
Adani Enterprises Ltd.,ADANIENT,Exclusive-India seeks to restart stalled Adani coal imports probe,2023-11-16,Negative
Adani Enterprises Ltd.,ADANIENT,Adani Enterprises sees mixed results amid significant sales drop in September 2023,2023-11-03,Neutral
Adani Enterprises Ltd.,ADANIENT,Adani Group companies bolster investor wealth Ambuja Cements leads with 2.77% gain,2023-11-02,Neutral
Adani Enterprises Ltd.,ADANIENT,Indian stock indices advance following US Federal Reserve's rate decision,2023-11-02,Neutral
Adani Enterprises Ltd.,ADANIENT,Adani Enterprises and Tata Motors set to announce Q2 results Reliance Industries plans ₹15000 crore bond issuance,2023-11-02,Neutral
Adani Enterprises Ltd.,ADANIENT,Asian markets surge following Federal Reserve's hint at policy shift,2023-11-02,Neutral
Adani Enterprises Ltd.,ADANIENT,NSE announces special trading session market closures for November,2023-11-01,Neutral
Adani Enterprises Ltd.,ADANIENT,Sun Pharma Tata Motors Adani Power among others to reveal Q2 earnings,2023-10-29,Neutral
Adani Enterprises Ltd.,ADANIENT,Exclusive-India regulator probing ties between Adani Group and Gulf Asia fund say sources,2023-10-11,Negative
Adani Enterprises Ltd.,ADANIENT,Disney in talks with Adani Sun TV to sell India assets -Bloomberg News,2023-10-06,Positive
Adani Enterprises Ltd.,ADANIENT,HDFC Bank anticipates massive inflows Adani stake changes - Indian market moves,2023-09-11,Neutral
Adani Enterprises Ltd.,ADANIENT,Asian stocks rise as China optimism helps ease pre-payrolls angst,2023-08-31,Neutral
Adani Enterprises Ltd.,ADANIENT,Adani family partners used offshore funds to invest in Indian group's stocks -report,2023-08-31,Neutral
Adani Enterprises Ltd.,ADANIENT,India indices drop after 2 days of gains on poor global cues PSU banks shine,2023-08-17,Positive
Adani Enterprises Ltd.,ADANIENT,Indian banks indices fall on RBI’s surprise move metals shine defy market mood,2023-08-10,Negative
Adani Enterprises Ltd.,ADANIENT,Adani Enterprises weighs exiting $6 billion Wilmar venture - Bloomberg News,2023-08-09,Neutral
Adani Enterprises Ltd.,ADANIENT,Nifty Sensex hit new life peaks Nifty cracks past 18900 mark metals shine,2023-06-28,Neutral
Adani Enterprises Ltd.,ADANIENT,Nifty trades flat with positive bias Adani Ent top gainer Market snippet,2023-06-26,Positive
Adani Enterprises Ltd.,ADANIENT,Powell and Fed speakers Adani Turkish lira - what's moving markets,2023-06-23,Neutral
Adani Enterprises Ltd.,ADANIENT,Adani slides on report of US regulatory probe over Hindenburg,2023-06-23,Neutral
Adani Enterprises Ltd.,ADANIENT,Nifty Only 6 Pts Away From Lifetime High Hits 2023 Peak,2023-06-19,Neutral
Adani Enterprises Ltd.,ADANIENT,Pharma Stocks Lead Gains in Weak Market Smallcap Indices Trump Benchmarks,2023-06-15,Negative
Adani Enterprises Ltd.,ADANIENT,Adani Ports recovers post-Hindenburg losses after panel gives all-clear,2023-05-23,Positive
Adani Enterprises Ltd.,ADANIENT,Fed decision Icahn targeted regional lenders slip - what's moving markets,2023-05-03,Neutral
Adani Enterprises Ltd.,ADANIENT,Asian stocks slump tracking US bank rout nonfarm payrolls awaited,2023-03-09,Negative
Adani Enterprises Ltd.,ADANIENT,Asian stocks slip on weak Chinese data Fed jitters persist,2023-03-08,Negative
Adani Enterprises Ltd.,ADANIENT,Adani Enterprises rallies to 1-month high after GQG investment,2023-03-06,Negative
Adani Enterprises Ltd.,ADANIENT,Asian stocks surge China lags on muted GDP outlook,2023-03-05,Neutral
Adani Enterprises Ltd.,ADANIENT,Waller's spicy speech ISM chipmaker updates - what's moving markets,2023-03-03,Positive
Adani Enterprises Ltd.,ADANIENT,Asian stocks rise China rallies on positive PMI data,2023-02-28,Positive
Adani Enterprises Ltd.,ADANIENT,Asian stocks sink as Fed fears outweigh China recovery hopes,2023-02-28,Positive
Adani Enterprises Ltd.,ADANIENT,Adani shares see renewed selling on report of $400 million debt talks,2023-02-27,Positive
Adani Enterprises Ltd.,ADANIENT,Asian stocks battered by Fed fears uncertainty over Chinese recovery,2023-02-27,Positive
Adani Enterprises Ltd.,ADANIENT,Asian stocks rattled by hawkish Fedspeak head for weekly losses,2023-02-17,Negative
Adani Enterprises Ltd.,ADANIENT,Indian stocks duck Asia rout Adani buoyed by strong results,2023-02-15,Negative
Adani Enterprises Ltd.,ADANIENT,Asian stocks retreat on rate hike uncertainty China outperforms,2023-02-09,Negative
Adani Enterprises Ltd.,ADANIENT,Adani share rout resumes as MSCI questions free float status,2023-02-08,Negative
Adani Enterprises Ltd.,ADANIENT,Asia stocks rise as Powell touts disinflation Nikkei hit by weak earnings,2023-02-07,Negative
Adani Enterprises Ltd.,ADANIENT,Asia stocks cautiously advance as Powell talk looms,2023-02-06,Positive
Adani Enterprises Ltd.,ADANIENT,Asian stocks slammed by US-China tensions Fed jitters,2023-02-05,Neutral
Adani Enterprises Ltd.,ADANIENT,Asian stocks await nonfarm payrolls Chinese markets sink,2023-02-03,Positive
Adani Enterprises Ltd.,ADANIENT,Weekly Comic Adani's woes are an opportunity for India,2023-02-02,Neutral
Adani Enterprises Ltd.,ADANIENT,Asian stocks rise as Fed fears ease India held back by Adani,2023-02-02,Neutral
Adani Enterprises Ltd.,ADANIENT,Adani Group shares plummet on $2.5 billion FPO cancellation SEBI probe,2023-02-01,Positive
Adani Enterprises Ltd.,ADANIENT,Fed meeting Exxon record Eurozone skirts recession - what's moving markets,2023-01-31,Negative
Adani Enterprises Ltd.,ADANIENT,Indian stocks lag Asian peers in January as Adani losses weigh,2023-01-31,Negative
Adani Enterprises Ltd.,ADANIENT,Asian stocks slide as Fed jitters outweigh positive Chinese data,2023-01-31,Negative
Adani Enterprises Ltd.,ADANIENT,Adani Dollar Bonds Rally From Record Lows After UAE Royal Boost,2023-01-30,Negative
Adani Enterprises Ltd.,ADANIENT,Central bank week Adani rout Nissan gets even - what's moving markets,2023-01-30,Negative
Adani Enterprises Ltd.,ADANIENT,Asian stocks sink as Fed week begins China reopens strong,2023-01-30,Negative
Adani Enterprises Ltd.,ADANIENT,Adani responds to Hindenburg report but stocks continue descent,2023-01-29,Neutral
Adani Enterprises Ltd.,ADANIENT,Stock market today Dow ekes out win as inflation cools Tesla leads growth stocks up,2023-01-27,Positive
Adani Enterprises Ltd.,ADANIENT,S&P 500 marches higher as cooling inflation cements Fed downshift bets,2023-01-27,Positive
Adani Enterprises Ltd.,ADANIENT,PCE Prices Intel slump Adani woe - what's moving markets,2023-01-27,Positive
Adani Enterprises Ltd.,ADANIENT,Adani Group shares slide further as Hindenburg row heats up,2023-01-27,Positive
Adani Enterprises Ltd.,ADANIENT,Microsoft's long shadow Tesla earnings Adani allegations - What's moving markets,2023-01-25,Positive
Adani Enterprises Ltd.,ADANIENT,Indian stocks slip as Adani losses weigh Asian markets rise,2023-01-25,Positive
Adani Enterprises Ltd.,ADANIENT,Adani Group shares tumble as short seller Hindenburg alleges fraud,2023-01-24,Negative
Adani Enterprises Ltd.,ADANIENT,World’s Second-Biggest Fortune Fails to Halt Rout in Adani Bonds,2022-09-21,Negative
Adani Enterprises Ltd.,ADANIENT,India's Gautam Adani Surpasses Jeff Bezos in Bloomberg's Billionaires Index,2022-09-16,Positive
Adani Enterprises Ltd.,ADANIENT,Australia's solar wind boom to power past grid woes in 2019,2019-01-20,Neutral
Adani Enterprises Ltd.,ADANIENT,Australia to amend $3.9 billion infrastructure fund in bid to develop country's north,2018-04-18,Negative
Adani Enterprises Ltd.,ADANIENT,India's Adani eyeing bid for SunEdison solar assets CEO,2016-06-10,Positive
Adani Enterprises Ltd.,ADANIENT,SunEdison Adani to invest $4 billion in Indian solar panel plant,2015-01-11,Neutral
Adani Enterprises Ltd.,ADANIENT,India on brink of 'quantum leap' Modi tells investors,2015-01-11,Neutral
Adani Enterprises Ltd.,ADANIENT,Australia Delays Decision On Adani's $15B Coal Project,2014-06-17,Negative
Adani Ports and Special Economic Zone Ltd.,ADANIPORTS,India stocks higher at close of trade Nifty 50 up 0.01%,2024-12-10,Neutral
Adani Ports and Special Economic Zone Ltd.,ADANIPORTS,India stocks higher at close of trade Nifty 50 up 0.35%,2024-11-27,Positive
Adani Ports and Special Economic Zone Ltd.,ADANIPORTS,Fitch places some Adani bonds on negative watch after US bribery charges,2024-11-25,Positive
Adani Ports and Special Economic Zone Ltd.,ADANIPORTS,Adani shares rise CFO says publicly listed firms not subject to US indictment,2024-11-24,Neutral
Adani Ports and Special Economic Zone Ltd.,ADANIPORTS,Asia stocks rise as chips cyclical gains help offset Ukraine war jitters,2024-11-21,Positive
Adani Ports and Special Economic Zone Ltd.,ADANIPORTS,Adani stocks tumble hit lower circuit on US bribery fraud charges,2024-11-20,Neutral
Adani Ports and Special Economic Zone Ltd.,ADANIPORTS,Asia stocks dip as Nvidia brings little cheer India slides amid Adani scandal,2024-11-20,Neutral
Adani Ports and Special Economic Zone Ltd.,ADANIPORTS,Indian billionaire Gautam Adani accused of $250 mln bribery scheme by the US,2024-11-20,Neutral
Adani Ports and Special Economic Zone Ltd.,ADANIPORTS,Adani shares fall amid Hindenburg-SEBI row,2024-08-12,Negative
Adani Ports and Special Economic Zone Ltd.,ADANIPORTS,Indian stocks volatile after BJP election shock,2024-06-05,Positive
Adani Ports and Special Economic Zone Ltd.,ADANIPORTS,Adani stocks fall 2% to 4% on report of US bribery probe,2024-03-18,Neutral
Adani Ports and Special Economic Zone Ltd.,ADANIPORTS,Adani Power receives Investment Bank Analyst Rating Update,2024-03-12,Positive
Adani Ports and Special Economic Zone Ltd.,ADANIPORTS,Adani Group marketing first dollar bond since Hindenburg report- BBG,2024-03-03,Neutral
Adani Ports and Special Economic Zone Ltd.,ADANIPORTS,Goldman Sachs raises Adani Ports target to Rs 855 on strong H2 outlook,2023-11-23,Positive
Adani Ports and Special Economic Zone Ltd.,ADANIPORTS,Indian banks indices fall on RBI’s surprise move metals shine defy market mood,2023-08-10,Negative
Adani Ports and Special Economic Zone Ltd.,ADANIPORTS,Nifty tops 19800 ahead of Fed outcome India VIX jumps 6%,2023-07-26,Positive
Adani Ports and Special Economic Zone Ltd.,ADANIPORTS,Bulls FIIs drive Indian indices to new high Nifty Tops 19100 Mark,2023-06-30,Neutral
Adani Ports and Special Economic Zone Ltd.,ADANIPORTS,Nifty Sensex hit new life peaks Nifty cracks past 18900 mark metals shine,2023-06-28,Neutral
Adani Ports and Special Economic Zone Ltd.,ADANIPORTS,CLSA bullish on Adani Ports stock as Mundra traffic surges ahead of peers,2024-10-30,Positive
Adani Ports and Special Economic Zone Ltd.,ADANIPORTS,Asia stocks muted with tech earnings in focus Japan extends gains,2024-10-28,Positive
Adani Ports and Special Economic Zone Ltd.,ADANIPORTS,Adani slides on report of US regulatory probe over Hindenburg,2023-06-23,Neutral
Adani Ports and Special Economic Zone Ltd.,ADANIPORTS,Nifty Only 6 Pts Away From Lifetime High Hits 2023 Peak,2023-06-19,Positive
Adani Ports and Special Economic Zone Ltd.,ADANIPORTS,Adani Ports recovers post-Hindenburg losses after panel gives all-clear,2023-05-23,Neutral
Adani Ports and Special Economic Zone Ltd.,ADANIPORTS,Adani Enterprises rallies to 1-month high after GQG investment,2023-03-06,Negative
Adani Ports and Special Economic Zone Ltd.,ADANIPORTS,Waller's spicy speech ISM chipmaker updates - what's moving markets,2023-03-03,Positive
Adani Ports and Special Economic Zone Ltd.,ADANIPORTS,Indian stocks duck Asia rout Adani buoyed by strong results,2023-02-15,Neutral
Adani Ports and Special Economic Zone Ltd.,ADANIPORTS,Adani share rout resumes as MSCI questions free float status,2023-02-08,Neutral
Adani Ports and Special Economic Zone Ltd.,ADANIPORTS,Adani responds to Hindenburg report but stocks continue descent,2023-01-29,Neutral
Adani Ports and Special Economic Zone Ltd.,ADANIPORTS,Adani Group shares slide further as Hindenburg row heats up,2023-01-27,Positive
Adani Ports and Special Economic Zone Ltd.,ADANIPORTS,Indian stocks slip as Adani losses weigh Asian markets rise,2023-01-25,Neutral
Adani Ports and Special Economic Zone Ltd.,ADANIPORTS,Adani Group shares tumble as short seller Hindenburg alleges fraud,2023-01-24,Negative
Adani Ports and Special Economic Zone Ltd.,ADANIPORTS,World’s Second-Biggest Fortune Fails to Halt Rout in Adani Bonds,2022-09-21,Negative
Adani Ports and Special Economic Zone Ltd.,ADANIPORTS,India stocks lower at close of trade Nifty 50 down 0.97%,2022-07-12,Neutral
Adani Ports and Special Economic Zone Ltd.,ADANIPORTS,India stocks lower at close of trade Nifty 50 down 0.62%,2022-05-25,Neutral
Adani Ports and Special Economic Zone Ltd.,ADANIPORTS,India stocks higher at close of trade Nifty 50 up 1.46%,2022-04-26,Neutral
Adani Ports and Special Economic Zone Ltd.,ADANIPORTS,India stocks lower at close of trade Nifty 50 down 1.27%,2022-04-22,Positive
Adani Ports and Special Economic Zone Ltd.,ADANIPORTS,India stocks lower at close of trade Nifty 50 down 0.62%,2022-04-11,Neutral
Adani Ports and Special Economic Zone Ltd.,ADANIPORTS,India stocks lower at close of trade Nifty 50 down 0.94%,2022-04-07,Positive
Adani Ports and Special Economic Zone Ltd.,ADANIPORTS,India stocks lower at close of trade Nifty 50 down 0.53%,2022-04-05,Negative
Adani Ports and Special Economic Zone Ltd.,ADANIPORTS,India stocks higher at close of trade Nifty 50 up 2.17%,2022-04-04,Neutral
Adani Ports and Special Economic Zone Ltd.,ADANIPORTS,India stocks higher at close of trade Nifty 50 up 0.60%,2022-03-29,Neutral
Adani Ports and Special Economic Zone Ltd.,ADANIPORTS,India stocks lower at close of trade Nifty 50 down 0.40%,2022-03-25,Positive
Adani Ports and Special Economic Zone Ltd.,ADANIPORTS,India stocks lower at close of trade Nifty 50 down 0.17%,2022-02-16,Neutral
Adani Ports and Special Economic Zone Ltd.,ADANIPORTS,India stocks higher at close of trade Nifty 50 up 0.29%,2022-01-11,Positive
Adani Ports and Special Economic Zone Ltd.,ADANIPORTS,India stocks lower at close of trade Nifty 50 down 2.22%,2022-05-12,Neutral
Adani Ports and Special Economic Zone Ltd.,ADANIPORTS,India stocks lower at close of trade Nifty 50 down 2.29%,2022-05-04,Neutral
Adani Ports and Special Economic Zone Ltd.,ADANIPORTS,India stocks lower at close of trade Nifty 50 down 0.83%,2022-04-29,Negative
Adani Ports and Special Economic Zone Ltd.,ADANIPORTS,Adani Group shares plummet on $2.5 billion FPO cancellation SEBI probe,2023-02-01,Positive
Adani Ports and Special Economic Zone Ltd.,ADANIPORTS,Indian stocks lag Asian peers in January as Adani losses weigh,2023-01-31,Negative
Adani Ports and Special Economic Zone Ltd.,ADANIPORTS,Adani Dollar Bonds Rally From Record Lows After UAE Royal Boost,2023-01-30,Negative
Adani Ports and Special Economic Zone Ltd.,ADANIPORTS,ndia stocks lower at close of trade Nifty 50 down 0.60%,2021-12-15,Negative
Adani Ports and Special Economic Zone Ltd.,ADANIPORTS,India stocks higher at close of trade Nifty 50 up 1.37%,2021-12-02,Negative
Adani Ports and Special Economic Zone Ltd.,ADANIPORTS,India stocks higher at close of trade Nifty 50 up 0.16%,2021-11-29,Positive
Adani Ports and Special Economic Zone Ltd.,ADANIPORTS,India stocks lower at close of trade Nifty 50 down 0.50%,2021-11-24,Negative
Adani Ports and Special Economic Zone Ltd.,ADANIPORTS,India stocks lower at close of trade Nifty 50 down 1.94%,2021-10-28,Positive
Adani Ports and Special Economic Zone Ltd.,ADANIPORTS,India stocks higher at close of trade Nifty 50 up 0.97%,2021-10-14,Negative
Adani Ports and Special Economic Zone Ltd.,ADANIPORTS,India stocks mixed at close of trade Nifty 50 up 0.06%,2021-08-25,Neutral
Adani Ports and Special Economic Zone Ltd.,ADANIPORTS,India stocks higher at close of trade Nifty 50 up 0.78%,2021-08-24,Neutral
Adani Ports and Special Economic Zone Ltd.,ADANIPORTS,India stocks higher at close of trade Nifty 50 up 0.28%,2021-08-23,Positive
Adani Ports and Special Economic Zone Ltd.,ADANIPORTS,India stocks higher at close of trade Nifty 50 up 0.31%,2021-08-17,Negative
Adani Ports and Special Economic Zone Ltd.,ADANIPORTS,India stocks lower at close of trade Nifty 50 down 0.35%,2021-08-06,Neutral
Adani Ports and Special Economic Zone Ltd.,ADANIPORTS,India stocks higher at close of trade Nifty 50 up 0.26%,2021-07-14,Negative
Adani Ports and Special Economic Zone Ltd.,ADANIPORTS,India stocks higher at close of trade Nifty 50 up 0.76%,2021-07-13,Neutral
Adani Ports and Special Economic Zone Ltd.,ADANIPORTS,India stocks mixed at close of trade Nifty 50 up 0.02%,2021-07-12,Neutral
Adani Ports and Special Economic Zone Ltd.,ADANIPORTS,India stocks lower at close of trade Nifty 50 down 0.24%,2021-07-09,Negative
Adani Ports and Special Economic Zone Ltd.,ADANIPORTS,India stocks lower at close of trade Nifty 50 down 0.54%,2021-06-23,Neutral
Adani Ports and Special Economic Zone Ltd.,ADANIPORTS,India stocks higher at close of trade Nifty 50 up 0.40%,2021-06-21,Negative
Adani Ports and Special Economic Zone Ltd.,ADANIPORTS,India stocks mixed at close of trade Nifty 50 down 0.05%,2021-06-18,Positive
Adani Ports and Special Economic Zone Ltd.,ADANIPORTS,India stocks lower at close of trade Nifty 50 down 0.48%,2021-06-17,Positive
Adani Ports and Special Economic Zone Ltd.,ADANIPORTS,India stocks lower at close of trade Nifty 50 down 0.64%,2021-06-16,Positive
Adani Ports and Special Economic Zone Ltd.,ADANIPORTS,India stocks higher at close of trade Nifty 50 up 0.08%,2021-06-14,Negative
Adani Ports and Special Economic Zone Ltd.,ADANIPORTS,India stocks lower at close of trade Nifty 50 down 0.67%,2021-06-09,Neutral
Adani Ports and Special Economic Zone Ltd.,ADANIPORTS,India stocks higher at close of trade Nifty 50 up 0.52%,2021-06-07,Negative
Adani Ports and Special Economic Zone Ltd.,ADANIPORTS,India stocks lower at close of trade Nifty 50 down 0.05%,2021-06-01,Positive
Adani Ports and Special Economic Zone Ltd.,ADANIPORTS,India stocks higher at close of trade Nifty 50 up 0.95%,2021-05-31,Positive
Adani Ports and Special Economic Zone Ltd.,ADANIPORTS,India stocks higher at close of trade Nifty 50 up 0.84%,2021-05-05,Positive
Adani Ports and Special Economic Zone Ltd.,ADANIPORTS,India stocks mixed at close of trade Nifty 50 up 0.02%,2021-05-03,Negative
Adani Ports and Special Economic Zone Ltd.,ADANIPORTS,India stocks higher at close of trade Nifty 50 up 0.92%,2021-04-07,Neutral
Adani Ports and Special Economic Zone Ltd.,ADANIPORTS,India stocks higher at close of trade Nifty 50 up 0.31%,2021-04-06,Positive
Adani Ports and Special Economic Zone Ltd.,ADANIPORTS,India stocks lower at close of trade Nifty 50 down 1.79%,2021-03-24,Positive
Adani Ports and Special Economic Zone Ltd.,ADANIPORTS,India stocks lower at close of trade Nifty 50 down 0.05%,2021-03-22,Negative
Adani Ports and Special Economic Zone Ltd.,ADANIPORTS,India stocks lower at close of trade Nifty 50 down 0.95%,2021-03-12,Neutral
Adani Ports and Special Economic Zone Ltd.,ADANIPORTS,India stocks lower at close of trade Nifty 50 down 1.08%,2021-03-04,Neutral
Adani Ports and Special Economic Zone Ltd.,ADANIPORTS,India stocks higher at close of trade Nifty 50 up 0.77%,2021-02-25,Positive
Adani Ports and Special Economic Zone Ltd.,ADANIPORTS,India stocks higher at close of trade Nifty 50 up 0.22%,2021-02-23,Positive
Adani Ports and Special Economic Zone Ltd.,ADANIPORTS,India stocks mixed at close of trade Nifty 50 down 0.07%,2021-02-12,Positive
